timestamp,user,fullname,text,retweets,replies,likes
2015-10-22T04:34:07,RSSorg,RSS,"What is the chord that can keep our diverse society together? Certainly, it is our eternalculture - Hindu culture. #RSSVijayaDashami",117,5,100
2015-10-22T04:36:13,RSSorg,RSS,"Those who have faith in Three chords Hindu culture, Hindu forefathers, Mother nation are Hindus #RSSVijayaDashami",171,15,144
2015-10-22T04:36:40,RSSorg,RSS,"Come on, let us all become Swayamsewaks and be part of this sacred work, because this the only way to build the Bharat #RSSVijayaDashami",190,12,160
2015-10-22T04:37:52,RSSorg,RSS,"Let us individually and collectively endeavor to accrd happiness, peace and redemption to human race. #RSSVijayaDashami",108,1,96
2015-10-22T04:38:22,RSSorg,RSS,This the way out and we have to do it. #RSSVijayaDashami,83,9,103
2015-10-24T13:03:51,RSSorg,RSS,"भारत के युवाओं की बुद्धिमत्ता,प्रतिभा और क्षमताएं विश्व में सर्वश्रेष्ठ हैं-Bhaiyaji  @Mumbai intellectuals' meetpic.twitter.com/lC3vOqUdaG",96,6,117
2015-10-24T13:08:00,RSSorg,RSS,"समाज की मानसिकता ही विकास का सबसे बड़ा कारक होता है - Bhaiyaj i@प्रबुद्ध नागरिक गोष्ठी,मुंबई 2/n",63,7,81
2015-10-24T13:10:28,RSSorg,RSS,"भौतिक विकास के साथ संवेदनशीलता और आत्मविश्वास का विकास आवश्यक। Bhaiyaji@प्रबुद्ध नागरिक गोष्ठी,3/n",56,4,71
2015-10-24T13:14:26,RSSorg,RSS,पृथ्वी को माँ मानकर जो हमारे लिए आवश्यक है वह उससे प्राप्त करना- भय्या जोशी जी 4/npic.twitter.com/TFlmwLBMw7,77,7,112
2015-10-24T13:17:07,RSSorg,RSS,"प्रकृति से  जितना निकाल सकता हूँ उतना निकाल सकने की मानसिकता ही वर्तमान समस्याओं की जड़ है- Bhaiyaji @प्रबुद्ध नागरिक गोष्ठी,मुंबई 5/n",74,4,100
2015-10-24T13:19:31,RSSorg,RSS,"प्रक्रियाओं के सरलीकरण से भ्रष्टाचार समाप्त होगा
लोकतंत्र में सरकार वही करती है जो जनता चाहती है - Bhaiyaji @प्रबुद्ध नागरिक गोष्ठी,6/n",62,5,83
2015-10-24T13:21:52,RSSorg,RSS,"समाज की मानसिकता में बदलाव और जागरूकता से ही समस्याओं का स्थायी हल संभव ।
Bhaiyaji @प्रबुद्ध नागरिक गोष्ठी,मुंबई 7/n",64,6,89
2015-10-24T13:23:35,RSSorg,RSS,"समाज के प्रबुद्ध जनों को समाज विकास की दीर्घकालिक योजना बनाने के लिए आगे आना चाहिए-  श्री भय्या जोशी जी @प्रबुद्ध नागरिक गोष्ठी,मुंबई 8/n",78,9,94
2015-10-26T02:15:28,RSSorg,RSS,संघ सम्पूर्ण हिन्दू समाज को अपना मानता है- Dr Bhagwat @ All India Valmiki Mahasabha Conference 1/npic.twitter.com/6tjZDhsN7v,104,11,140
2015-10-26T02:21:48,RSSorg,RSS,बाल्मीकि समाज हिन्दू समाज का ही अभिन्न अंग है इसलिए मैं आपके पास प्रेमभरा ह्रदय लेकर आया हूँ- Dr Bhagwat 2/npic.twitter.com/YEsJeGLQGY,120,9,153
2015-10-26T02:38:25,RSSorg,RSS,"संघ सम्पूर्ण हिन्दू समाज को अपना मानता है,जातिगत भेदों को नहीं मानता - Dr Bhagwat 3/npic.twitter.com/udld7TJ5Jn",142,19,156
2015-10-26T03:07:01,RSSorg,RSS,एक वर्ग दुर्बल रहा तो समाज सबल नहीं हो सकता जैसे श्रृंखला का बल उसके सबसे दुर्बल कड़ी के बराबर ही होता-Dr Bhagwat n/n,124,12,131
2015-10-27T08:09:21,RSSorg,RSS,Wish you all a prosperous and purposeful life ahead on this auspicious occasion of Maharshi Valmeeki Jayanti.pic.twitter.com/RPxbR27k4W,169,9,196
2015-10-27T09:07:39,RSSorg,RSS,pic.twitter.com/3DlAKV6abm,143,16,193
2015-10-28T06:22:18,RSSorg,RSS,Remembering Sister Nivedita's dedicated life towards the Hindu renaissance on her birth anniversary.pic.twitter.com/xoZcnqq46n,199,5,187
2015-10-28T06:23:22,RSSorg,RSS,"Tributes to Sister Nivedita, embodiment of Hindutva who dedicated her life to create awareness & pride in Hindus, being foreigner- Dr Vaidya",118,6,133
2015-10-29T11:14:15,RSSorg,RSS,Dr Manmohan Vaidya will brief the press about #rssabkm @ Ranchi,58,3,64
2015-10-29T14:26:45,RSSorg,RSS,RSS has reached almost 90% Taluks now and planning to reach every mandal ie cluster of 8 or 9 villages : Dr Vaidya,147,13,159
2015-10-29T14:26:45,RSSorg,RSS,"Imbalance in population growth will be discussed in #rssabkm : 
Dr Vaidya",85,11,139
2015-10-31T12:17:33,RSSorg,RSS,"Resolution on ""Challenge of imbalance in the population growth rate"" passed in RSS ABKM.",121,13,147
2015-10-31T13:32:47,RSSorg,RSS,pic.twitter.com/7AqjqFOuOc,79,12,112
2015-11-01T08:10:00,RSSorg,RSS,"Along with the org discussion RSSABKM, took report in detail abt the service activities: Bhaiyaji 1/n",74,2,88
2015-11-01T08:12:54,RSSorg,RSS,"RSS swayamsevaks are engaged in water conservation, sanitation & environmental activities in big number. Planing to further it. 2/n",161,14,172
2015-11-01T08:15:18,RSSorg,RSS,"Sinister attempts are made by some elements to ridicule Hindu culture & organisations, it is highly deplorable
3/n",149,18,137
2015-11-01T08:17:23,RSSorg,RSS,"RSSABKM
Statement on the millennial birth anniversary of Abhinavagupta was issued n/n",75,1,97
2015-11-01T11:37:00,RSSorg,RSS,Statement of Sarkaryavah Bhaiyaji Joshi about Sai Baba is being distorted by media: Dr Vaidya,88,10,106
2015-11-01T11:42:05,RSSorg,RSS,Every individual in Hindu society has freedom to decide and worship God. There are many swayamsevaks in RSS who are Sai devotees: Dr Vaidya,186,29,193
2015-11-03T13:29:47,RSSorg,RSS,The congress that has been extremely intolerant about RSS is unable to tolerate the growth and acceptance of RSS in the country- Dr Vaidya,504,74,397
2015-11-05T03:56:15,RSSorg,RSS,To the attention of Bihar Voters.pic.twitter.com/x4ch3tfKwH,541,56,479
2015-11-05T15:06:11,RSSorg,RSS,Equating RSS with ISIS shows poor historian Irfan Habib has either not studied history of RSS or intentionally spreads lies: Dr Vaidya,354,85,297
2015-11-07T12:59:29,RSSorg,RSS,"Senior pracharak and member of All India executive of RSS shri Mukundrao Panshikar's sudden demise has shocked everybody. 
-Dr Vaidya",111,14,120
2015-11-07T13:02:25,RSSorg,RSS,Panshikarji has lead RSS in Mahrshtra for many yrs. He has successfully created a dynamic leadership for Dharmajagaran vibhag-Dr Vaidya,80,6,113
2015-11-09T12:37:42,RSSorg,RSS,Sarsanghachalak Dr. Mohanrao Bhagwat greeted President of India shri. Pranab Mukherjee on occasion of Diwali: Dr Vaidya,124,6,159
2015-11-09T12:39:17,RSSorg,RSS,"Dr Bhagwatji is in Delhi to meet some dignitaries, a routine sampark.
Meeting Rashtrapatiji right now.
- Dr Vaidya",124,25,168
2015-11-13T03:30:32,RSSorg,RSS,We do not subscribe to the views expressed on @rss_org as it is not the official Twitter handle of RSS :- Dr Manmohan Vaidya,533,74,385
2015-11-15T01:03:36,RSSorg,RSS,"We condemn the kind of lowlevel journalism The Hindu is doing by intentionally giving misleading title to malign RSS: Dr ManmohanVaidya 
1/2",506,99,287
2015-11-15T01:04:18,RSSorg,RSS,The Hindu prominently published a baseless allegation by Ms Pansare without caring to take RSS view: Dr Vaidya 2/2pic.twitter.com/2eJvMdnS4C,447,85,275
2015-11-17T14:11:32,RSSorg,RSS,"Ashok Singhalji's sad demise is a grt loss, he was a fearless personality respected by all. Dr Bhagwat @ Kannurpic.twitter.com/gBtCt1mhnA",236,18,328
2015-11-17T15:07:53,RSSorg,RSS,"स्व.अशोक जी के निधन का समाचार वेदना दायक है.अंतिम संस्कार मे उपस्थित
रहने हेतु कल दिल्ली पहूंच रहा हु.
विनम्र श्रद्धांजली
भैया जोशी",163,22,254
2015-11-17T15:19:12,RSSorg,RSS,Obituary statement on Shri Ashok Singhalji's sad demisepic.twitter.com/mhnYY2gmSY,195,20,242
2015-11-28T11:29:51,RSSorg,RSS,International conference to focus on all aspects of indigenous research #ResearchForResurgence,101,14,144
2015-11-28T11:34:11,RSSorg,RSS,"@DrThinkTank on Feb 11, 12, 13 @ nagpur organised by Bharatiya Shikshan Mandal",15,1,33
2015-11-28T11:36:21,RSSorg,RSS,"@RSSorg on 11,12,13 feb 2016 at Nagpur organised by Bharatiya Shikshan Mandal",69,4,93
2015-11-28T12:15:54,RSSorg,RSS,Research is Education.Research is Development.#ResearchForResurgence,171,10,176
2015-11-28T12:40:38,RSSorg,RSS,Social Sciences need Revival.Start Research from Bhartiya Prespective #ResearchForResurgence,175,36,211
2015-12-03T05:43:08,RSSorg,RSS,भारत धर्म और संस्कृति प्रधान देश है। राम हमारे आदर्श हैं। कोई उनको भगवान और कोई महापुरुष मानता है। Dr Bhagwat 1/3,302,22,403
2015-12-03T05:44:57,RSSorg,RSS,स्वतंत्र भारत के प्रथम गृहमंत्री के प्रयास से सोमनाथ के ध्वस्त मंदिर का पुनरुद्धार कराया गया और राष्ट्रपति ने शिलान्यास किया था DrBhagwat2/3,285,22,374
2015-12-03T05:45:30,RSSorg,RSS,"राम और शरद कोठारी के जीवन से प्रेरणा लेकर समाज खड़ा हो और सोमनाथ के समान भव्य राम मंदिर के निर्माण हेतु तैयार हो।
Dr Bhagwat 3/3",316,49,436
2015-12-06T07:40:44,RSSorg,RSS,"डॉ. अम्बेडकर की पुण्यतिथि पर उनके जीवन से प्रेरणा लेने की आज आवश्यकता। 
Dr Bhagwatpic.twitter.com/hPvYarC10d",128,17,249
2015-12-14T04:31:26,RSSorg,RSS,"A true national irrespective of his Food habits, dress code or method of worship can join RSS &work for our Nationpic.twitter.com/9Ee5eNqKx3",678,58,523
2015-12-14T07:53:28,RSSorg,RSS,pic.twitter.com/TjJWB2cKyK,161,8,217
2015-12-14T07:54:14,RSSorg,RSS,"To spread lies about RSS is an old game of frustrated Congress Party from Nirmal Khatri to Rahul Gandhi.
-Dr Manmohan Vaidya",464,39,404
2015-12-16T04:31:26,RSSorg,RSS,A grand function to honour Army personnel in #Chennai today. #SevabharatihonoursArmy,140,5,199
2015-12-16T04:43:44,RSSorg,RSS,"Army plunged into daring rescue operations during #ChennaiFloods 
#SevabharatihonoursArmy",106,0,193
2015-12-16T16:40:12,RSSorg,RSS,"As long as social discrimination remains in the society, reservation is needed- Dr Bhagwat",253,49,340
2015-12-16T16:44:49,RSSorg,RSS,We should all work together to end the caste base discrimination in the society: RSS,369,58,489
2015-12-18T11:04:37,RSSorg,RSS,"Bhagwat's statement""Till social discrimination exists reservtion should continue"" is consistent wth declared stand of RSS on resrvtion. 1/2",141,16,199
2015-12-18T11:04:56,RSSorg,RSS,"Calling it U-turn by section of media is baseless, biased, malicious and condemnable. Dr. Vaidya. 2/2",118,13,208
2015-12-29T12:33:32,RSSorg,RSS,We are considering the whole universe as a single family: Bhaiyaji@ViswaSanghShibir,101,28,178
2015-12-29T12:35:37,RSSorg,RSS,We dont want to make anyone our slaves: Bhaiyaji @ViswaSanghShibir,81,10,177
2015-12-29T12:35:42,RSSorg,RSS,'Hindu jage to Viswa Jagega' is our firm belief: Bhaiyaji @ViswaSanghaShibir,107,26,224
2015-12-29T12:39:30,RSSorg,RSS,We are the cultural ambassadors of this great nation: Sumitra Mahajan @ViswaSanghShibir,111,20,213
2015-12-29T12:43:10,RSSorg,RSS,"We went abroad to give, not to take: Bhaiyaji@ViswaSanghShibir",92,19,207
2016-01-03T11:54:09,RSSorg,RSS,"#ShivShaktiSangam
सावित्रीबाई फुले जी को उनकी जयंती पर समरण किया गया |",115,12,280
2016-01-06T11:02:02,RSSorg,RSS,"पठानकोट आतंकी हमले में शहीद हुए वीरो को नमन, जिन्होंने मातृभूमि की रक्षा हेतु अपने प्राणों की आहुति दी।",244,44,491
2016-01-18T05:50:55,RSSorg,RSS,The news telecast on some channels about firing at Ludhiana RSS karyalay is factually wrong: Dr Vaidya 1/2,166,10,174
2016-01-18T05:51:04,RSSorg,RSS,Shakha in charge aborted an effort to fire at him by some inidentified miscreants at beginning of prabhat shakha at Ludhiana. Dr Vaidya 2/2,156,4,149
2016-01-18T13:19:44,RSSorg,RSS,Attempt to attack RSS worker at Ludhiana is condemnable and certainly a cowardly act.,189,19,219
2016-01-26T03:57:49,RSSorg,RSS,"Hearty greetings to all countrymen on the occasion of 67th Republic day.
Dattatrey @KGT Intr ntnl school Mumbai.pic.twitter.com/VTFJCgKjvE",136,5,268
2016-01-26T04:40:30,RSSorg,RSS,"Dr Mohan Bhagwat hoists national flag in the historic Mohitewade ground where RSS was started 
@Dr HedgewarBhavan.pic.twitter.com/Ha9A24VYzU",221,29,418
2016-01-26T05:20:11,RSSorg,RSS,"Sarsanghchalak Dr Mohan Bhagwat 
@Dr HedgewarBhavan, RSS Head Quarters, Nagpur.pic.twitter.com/9XIZGPK9kI",291,35,495
2016-01-26T06:47:45,RSSorg,RSS,"SarKaryavah Suresh(Bhaiyaji)Joshi in Republic Day celebration at MIT Medical College, Latur (Maharashtra)pic.twitter.com/Jr3ZCbeQjm",179,37,416
2016-02-14T07:45:24,RSSorg,RSS,"Leftist led demo at JNU in support of a terrorist convict with anti Bharat slogans on placards is a matter of grave concern
Dr Vaidya",246,30,309
2016-02-14T07:49:48,RSSorg,RSS,"At the exchequer money, instead of studying students involving in anti Bharat activity & some teachers supporting it is serious:Dr Vaidya2/3",239,26,279
2016-02-14T07:52:23,RSSorg,RSS,"Instead of condemning &demanding strict action against anti national activities some political leaders are condoning this act 
Dr Vaidya 3/3",247,46,354
2016-02-16T16:44:52,RSSorg,RSS,The murder of young RSS worker Sujith by CPM once again shows that party's obsession with blood & its philosophy of annihilation: Dr Vaidya,388,34,362
2016-02-16T16:46:10,RSSorg,RSS,"Communists have a long track record of spilling blood of political opponents whether it is Russia, China, West Bengal or Kerala: Dr Vaidya",460,71,501
2016-03-02T14:34:51,RSSorg,RSS,Dr Manmohan Vaidya's interviewhttp://m.economictimes.com/opinion/interviews/nothing-anti-india-should-be-tolerated-dr-manmohan-vaidya-rss/articleshow/51172073.cms …,114,10,184
2016-03-04T13:05:15,RSSorg,RSS,"मा:भय्या जी जोशी ने 'बालजगत' के रजत जयंती समारोह के उद्घाटन कार्यक्रम में कहा कि ""भारत में समाज परिवर्तन की आवश्यकता हमेशा रही है""
1/n",120,4,249
2016-03-04T13:06:23,RSSorg,RSS,जहाँ  एक ओर समाज को अच्छा बनाने वाले महापुरुष काम कर रहे थे वहीं उसी कालखण्ड में उसको तोड़ने वाले भी काम कर रही थी  : Bhaiyaji 2/n,192,14,327
2016-03-04T13:09:34,RSSorg,RSS,"हमारे इतिहास में सत्य-असत्य, न्याय-अन्याय,धर्म-अधर्म देव-असुर का संघर्ष हमेशा रहा है, विजय हमेशा धर्म,सत्य न्याय की ही होती है Bhaiyaji3/n",239,12,421
2016-03-04T13:10:55,RSSorg,RSS,"इस देश में ऐसी श्रेष्ठ परम्पराएं रहीं हैं जिनके कारण अनेक आक्रमणों के बाद भी हम जीवित हैं ।
Bhaiyaji 4/n",160,11,296
2016-03-04T13:13:30,RSSorg,RSS,हिंदु समाज की एक बड़ी विशेषता यह है कि वह अन्य समाजों की तरह फतवों/कमांडेंटस के आधार पर नहीं महापुरुषों के आदर्श देखकर चलता है।Bhaiyaji5/n,260,30,425
2016-03-04T13:18:41,RSSorg,RSS,जेएनयू मामले में देश विरोधी गतिविधियां चल रही हैं तो उन्हें कड़ाई से रोकना चाहिए: Bhaiyaji After progm while talking to scribes 6/n,136,14,270
2016-03-04T13:20:34,RSSorg,RSS,"सारा प्रकरण कोर्ट की प्रक्रिया में है. सत्य बाहर आएगा.
Bhaiyaji while answering the queries after progm 7/n",97,6,210
2016-03-04T13:22:25,RSSorg,RSS,शिक्षा के क्षेत्र में इस प्रकार की प्रवृत्ति को पनपने नहीं देना चाहिए. शिक्षा का केन्द्र है शिक्षा अच्छी होनी चाहिए. Bhaiyaji 8/n,141,17,287
2016-03-04T13:26:46,RSSorg,RSS,राहुल गांधी कहते हैं RSS अपनी विचारधारा थोप रहा है. उनके सामने RSSजैसा कोई निशाना साधने के लिए ही तो है. Bhaiyaji n/n,152,54,309
2016-03-10T11:05:55,RSSorg,RSS,Dr Manmohan Vaidyaji addressing press on the previous day of ABPS 2016 @Nagaurpic.twitter.com/Uc6olyXTFf,97,4,230
2016-03-10T11:12:03,RSSorg,RSS,"There will be 3 resolutions in the ABPS
1. On Affordable, Accessible, Quality education for all
2. Affordable Health service for all",146,12,224
2016-03-10T23:14:40,RSSorg,RSS,"3. Need of practicing Samarasata (Social Harmony) in day to day life.
Strength of the Society is Strength of the Nation.",131,10,224
2016-03-11T04:01:36,RSSorg,RSS,Dr Krishnagopalji (Sah Sarkaryavah) addressing press on the first day of ABPS,80,7,170
2016-03-12T11:38:52,RSSorg,RSS,Mr. Azad comparing ISIS with RSS exhibits the intellectual bankruptcy of Congress- Dr: Vaidya 1/n,287,60,345
2016-03-12T11:40:23,RSSorg,RSS,And its unwillingness to deal with fundamentalist and cruel forces like ISIS- Dr Vaidya n/n,143,18,230
2016-03-12T16:45:44,RSSorg,RSS,The decision about change in uniform of RSS has not been taken yet. Discussion is on. News doing rounds about change is not true -Dr Vaidya,299,70,395
2016-03-13T07:20:49,RSSorg,RSS,SARKARYAVAH announces the change in uniform. BROWN trousers replaces Khaki shorts.,474,107,616
2016-03-15T04:37:40,RSSorg,RSS,I strongly condemn the attack by CPM workers on a peaceful protest march by BJPsupporters in Kerala: Dr Vaidyapic.twitter.com/SxwnYRq2wB,618,70,596
2016-03-15T11:26:05,RSSorg,RSS,pic.twitter.com/4K6G6eKIri,247,38,333
2016-03-28T07:04:59,RSSorg,RSS,"The leftist scholars' bid to undermine India's glorious identity was foiled by young Hindu activists and HEF in California, USA. 
Dr Vaidya",249,16,453
2016-03-28T07:07:23,RSSorg,RSS,"Congrats to Hindu activists to successfully oppose & contest the suggestion to
replace 'India' by 'SouthAsia' in text books in USA
Dr Vaidya",475,48,772
2016-04-02T07:44:40,RSSorg,RSS,"DR। द्वारा आयोजित कार्यक्रम में भैयाजी ने कहा-
 देश-राज्य-राष्ट्र तीनों का अलग-2 अर्थ है,परंतु अंग्रेज़ों ने इसमें भ्रम उत्पन्न किया। 1/n",154,5,244
2016-04-02T07:46:40,RSSorg,RSS,देश भौगोलिक इकाई होने के कारण इसकी सीमा छोटी-बड़ी होती रहती हैं।- भैया जी 2/n,149,1,256
2016-04-02T07:47:32,RSSorg,RSS,राज्य आवश्यक सुविधा और सुरक्षा प्रदान करने वाली राजनीतिक इकाई है जो समय के अनुरूप बदलती रहती है। Bhaiyaji 3/n,158,2,286
2016-04-02T07:48:26,RSSorg,RSS,"राष्ट्र हजारों वर्षों में स्वयं विकसित हुई एक सांस्कृतिक जीवनशैली होती है,जो कभी नहीं बदलती। 4/n",223,10,366
2016-04-02T07:49:54,RSSorg,RSS,"नागरिकता कानून के द्वारा प्राप्त की जा सकती है,पर देश के साथ माँ-पुत्र के संबंध की अनुभूति रखने वाला ही राष्ट्रीय होता है। 5/n",227,5,377
2016-04-02T07:50:44,RSSorg,RSS,एक राष्ट्र में अनेक राज्य और एक राज्य में अनेक राष्ट्र हो सकते हैं। Bhaiyaji 6/n,166,3,289
2016-04-02T07:51:01,RSSorg,RSS,भारत एक नया देश बन रहा है यह भी अंग्रेजों द्वारा  फैलाया भ्रम है।भारत प्राचीन राष्ट्र है। Bhaiyaji 7/n,252,14,425
2016-04-02T07:53:19,RSSorg,RSS,1947 में संविधान द्वारा राजकीय ध्वज के रूप में  स्वीकार किए गए तिरंगे का सम्मान करना प्रत्येक नागरिक का दायित्व है। 8/n,388,28,633
2016-04-02T07:57:38,RSSorg,RSS,भगवा ध्वज प्राचीन काल से इस राष्ट्र के प्रतीक के रूप में श्रद्धा का स्थान रखता है। Bhaiyaji 9/n,324,27,577
2016-04-02T07:58:38,RSSorg,RSS,हमारे लिए तिरंगा और भगवा ध्वज समान रूप से वंदनीय है। Bhaiyaji 10/n,343,35,640
2016-04-02T08:00:12,RSSorg,RSS,जण-गण-मन में राज्य की परिकल्पना प्रगट होती है तो वन्देमातरम् में राष्ट्र की।दोनों का सम्मान सबको करना ही चाहिए। Bhaiyaji 11/n,328,20,584
2016-04-02T08:12:40,RSSorg,RSS,जो इस भूमि को माँ मानते हैं वे 'भारत माता की जय' कहते है जो इस भूमि को भोगभूमि मानते हैं वे ही 'भारत माता की जय' कहने से इनकार करते हैं n/n,497,97,828
2016-04-02T11:18:10,RSSorg,RSS,"It is mandatory that every citizen of Bharat should respect Tiranga: 
Dr Manmohan Vaidya's statementpic.twitter.com/2Fe2dKbsDQ",470,45,678
2016-04-06T00:16:28,RSSorg,RSS,RSS is always with national causepic.twitter.com/jEP8Lv6SN5,299,32,420
2016-04-06T05:22:56,RSSorg,RSS,गुरु माता चंद कौर की हत्या मानवता के प्रति जघन्य अपराध - Bhaiyyajipic.twitter.com/hXAALKhGZK,183,10,301
2016-04-06T16:22:15,RSSorg,RSS,RSS Sarkaryavah Suresh (Bhaiyaji) Joshi's condolence message on the sad demise of Smt Kamla Advanipic.twitter.com/sT9RSXZG9o,141,6,306
2016-04-06T16:35:14,RSSorg,RSS,Suresh (Bhaiyaji) Joshi's (Sarkaryavah RSS) condolence message on the sad demise of Smt Kamla Advanipic.twitter.com/bwn5wNMboh,186,12,392
2016-04-10T05:37:22,RSSorg,RSS,Accident during the fireworks at Kollam temple is heartbreaking &shocking.No words are sufficient to express the agony & pain- Dr Vaidya,318,29,544
2016-04-10T09:01:27,RSSorg,RSS,Statement of Dr Bhagvat and Bhayyaji on the highly shocking and painful tragedy in Kollam Puttingal Devi temple.pic.twitter.com/oEEDvYJ9d3,492,44,689
2016-05-02T11:09:17,RSSorg,RSS,Condolence message from RSS on Shradhey Balraj Madhok's demisepic.twitter.com/Rie88W87yN,396,65,759
2016-06-10T06:56:20,RSSorg,RSS,"RSS does not work through statepower or with the support of it. RSS works among the people, with the people and for the people.Dr Vaidya 2/3",284,23,444
2016-06-10T07:34:49,RSSorg,RSS,Banning Govt employees to participate in RSS programs has already been proved unconstitutional by courts in multiple cases: Dr Vaidya 1/3,265,15,424
