timestamp,user,fullname,text,retweets,replies,likes
2015-02-23T16:38:02,RSSorg,RSS,"In reply Bhagavatji said, ""let Mother Teresa know her motive for Seva, we do Seva without expecting any returns""
Dr M Vaidya",402,61,220
2015-02-24T01:53:28,RSSorg,RSS,"When 'seva' is done nothing is expected in return expect the wellbeing of the affected. 
Dr Bhagwat @Bharatpur",126,12,101
2015-02-24T01:54:58,RSSorg,RSS,"Whether a person wishes to convert to Christianity should be left to the person.
Dr Bhagwat",105,16,96
2015-02-24T01:55:54,RSSorg,RSS,"To goad people to convert in the name of 'seva' is an affront to the service being done.
Dr Bhagwat @Bharatpur",123,7,90
2015-02-24T01:57:12,RSSorg,RSS,"Service has to be completely selfless and expecting absolutely nothing in return.
Dr Bhagwat @Bharatpur",122,8,111
2015-02-24T01:58:22,RSSorg,RSS,"Those who are the recipients of such selfless 'seva' may be thinking that they have seen their god in those who serve
Dr Bhagwat @Bharatpur",74,5,81
2015-02-24T01:59:26,RSSorg,RSS,"Those who serve would be thinking that their life became blessed after getting an opportunity to serve the needy.
Dr Bhagwat @Bharatpur",78,6,97
2015-02-24T07:03:11,RSSorg,RSS,डां. भागवत के बयान को पूरे संदर्भ में देखा जाना चाहिए. उन्होने निस्वार्थ सेवा  के भारतीय सिद्धान्त की व्याख्या की है. http://vskbharat.com/%E0%A4%B8%E0%A4%B0%E0%A4%B8%E0%A4%82%E0%A4%98%E0%A4%9A%E0%A4%BE%E0%A4%B2%E0%A4%95-%E0%A4%9C%E0%A5%80-%E0%A4%95%E0%A4%BE-%E0%A4%AA%E0%A5%82%E0%A4%B0%E0%A4%BE-%E0%A4%89%E0%A4%A6%E0%A5%8D%E0%A4%AC/ …,135,13,123
2015-02-24T07:10:25,RSSorg,RSS,One has to go by what Dr. Bhagavat has said in its totality. He was dwelling on the concept of service in the Bharatiya context.,132,25,126
2015-02-24T07:58:01,RSSorg,RSS,कार्यक्रम के मुख्य अतिथि प्रकाश सिंह जी (Ex DG BSF) ने सेवा की आड़ में कन्वर्जन पर चिंता जताई। उक्त पृष्ठभूमि में डॉ. भागवत का वक्तव्य है।,96,12,114
2015-02-24T08:14:36,RSSorg,RSS,Dr. Bhagavat was responding to the observation made by chief guest of function Prakash Singh Ex DG BSF that under the guise of service (1/n),81,12,88
2015-02-24T08:16:35,RSSorg,RSS,what was going on was religious conversion. (n/n),47,29,71
2015-02-26T05:53:34,RSSorg,RSS,"Dr Bhagwatji to address Veer Savarkarji's50th Punyatithi SmrutiVarsh ceremony at Dadar, Mumbai, today at 7.00pm",63,3,83
2015-02-26T15:16:31,RSSorg,RSS,विविधता का सहज स्वीकार यही हमारी विशेषता थी और है भी | पूजा हमारे लिये इसलिए महत्वपूर्ण नहीं थी पर अपनी ही पूजा का दुराग्रह करनेवालों (1/2),75,14,108
2015-02-26T15:16:51,RSSorg,RSS,"से जब हमारा परिचय हुआ तभी हमे धक्का लगा: प.पू. मोहन भागवत जी @ सावरकर स्मृतिवर्ष समारोह, दादर  (2/2)pic.twitter.com/RnhCqU4P0x",84,10,125
2015-02-26T16:53:02,RSSorg,RSS,"सावरकरजी के जीवनकार्य के परिचायक शब्द है स्वातंत्र्य, दूसरा है अद्ययावत, अद्यतनता
-Dr Bhagwat",114,22,165
2015-03-12T11:11:28,RSSorg,RSS,Dr Manmohan Vaidya addressing press at Nagpur.pic.twitter.com/wbk9M0t2wL,48,3,79
2015-03-12T11:14:24,RSSorg,RSS,Two Resolutions are under consideration before Akhil Bharatiya Pratinidhisabha. 1. International yoga day 2. Education in Mother tongue,79,14,111
2015-03-13T11:25:32,RSSorg,RSS,Sasanghachalak Dr Bhagawat offering floral tributes before Doctorji's statue #RSSPratinidhisabhapic.twitter.com/Q31BoU3pqB,97,6,159
2015-03-14T13:21:33,RSSorg,RSS,Bhaiyaji Joshi re-elected as Sarkaryawah of RSS for the third timepic.twitter.com/aV9VPRfK66,138,15,161
2015-03-15T07:05:19,RSSorg,RSS,Bhaiyaji Joshi addressing the press #RSSABPS Nagpurpic.twitter.com/eec7YrHp7q,61,6,82
2015-03-15T07:07:58,RSSorg,RSS,"RSS has reached more than 54,000 villages in our country
-Bhaiyaji Joshi #RSSABPS2015",150,17,150
2015-03-15T07:21:01,RSSorg,RSS,"हिन्दू एक जीवन शैली है,
 स्वेच्छा से किसी एक पूजा पद्धति स्वीकार करने में कोई आपत्ति नहीं
लेकिन वह देश के विरुद्ध नहीं होना चाहिए
Bhaiyaji",284,24,282
2015-03-15T07:24:50,RSSorg,RSS,"Resolution has been approved on the necessity of Primary education in Mother Tongue
#RSSABPS",114,18,142
2015-03-15T07:31:10,RSSorg,RSS,"हिन्दू अगर किसी अन्य देशों से पीड़ित होकर इधर आता है तो इस देश का धर्म बनता है उनसे सम्मान पूर्वक स्वागत करना 
Bhaiyaji #RSSABPS",254,44,302
2015-03-21T03:19:13,RSSorg,RSS,Best wishes on this auspicious new beginning. Let this sacred occasion gives us all enough energy and strength to do good for others.,146,19,193
2015-03-28T02:57:33,RSSorg,RSS,श्री रामनवमी की शुभकामनाएंpic.twitter.com/aNevXeA7FI,232,50,274
2015-04-04T13:13:02,RSSorg,RSS,National Seminar on Ekatma Manava Darshanam –inaugurated by RSS Joint General Secretary Dattatreya Hosabolehttp://vskkerala.com/national-seminar-on-ekatma-manava-darshanam-was-inaugurated-by-rss-joint-general-secretary-dattatreya-hosabole/ …,55,5,74
2015-04-05T12:13:27,RSSorg,RSS,"हमें सर्वांग सुंदर समाज बनाना है, जिसमें प्रत्येक व्यक्ति समर्थ हो. Dr Bhagwatpic.twitter.com/jH1NHeErqm",141,23,215
2015-04-05T12:15:25,RSSorg,RSS,"सेवा में कोई भेद नहीं होता, इसलिये इसकी पात्रता के लिये हिंदू या स्वयंसेवक होना जरूरी नहीं है. Dr Bhagwat @sevasangamam",137,12,178
2015-04-05T12:16:34,RSSorg,RSS,"सेवा संबंध निरपेक्ष आत्मीयता का है, जिसमें किसी मुआवजे की अपेक्षा नहीं है. Dr Bhagwat",87,15,136
2015-04-07T13:03:45,RSSorg,RSS,परम पूजनीय बाबासाहेब ने सदैव हिन्दू व्यवहार का विरोध किया हिन्दू चिंतन का नहीं- Bhaiyaji @vivek spl release fnctn 1/7pic.twitter.com/w35JIte84u,62,4,77
2015-04-07T13:07:24,RSSorg,RSS,"समाज की शक्ति का मापक उसका सबसे दुर्बल हिस्सा ही होता है  Bhaiyaji 2/7
@vivek spl release functionpic.twitter.com/sZFk3uIjtJ",58,1,85
2015-04-07T13:08:20,RSSorg,RSS,"परम पूजनीय बाबासाहेब ने कहा था  कि कानून से मात्र समानता मिलेगी... सम्मान,आत्मीयता और घरों में प्रवेश नहीं-Bhaiyaji3/7",70,6,94
2015-04-09T08:33:50,RSSorg,RSS,"Govt & security forces deserve lauds for saving people of Bharat &other countries too to safety from conflict infested Yemen 
Dr Vaidya",90,4,101
2015-04-09T08:35:27,RSSorg,RSS,"यमन में मानवता की रक्षा कर भारत ने 'वसुधैव कुटुम्बकम' की अपनी परंपरा की मिसाल दी है
-डॉ वैद्य",160,2,175
2015-04-09T08:39:03,RSSorg,RSS,26 से ज्यादा देशो के 250 से अधिक नागरिकों को यमन से सुरक्षित निकाल ने पर भारत सरकार और सुरक्षा बल को हार्दिक बधाई | -डॉ वैद्य,169,14,201
2015-04-14T12:24:08,RSSorg,RSS,बैशाखी पर्व की हार्दिक शुभकामनाएं,45,3,68
2015-04-14T13:38:49,RSSorg,RSS,Dr Ambedkar was our most celebrated national leader.. Sri Narendra Yadav,44,3,72
2015-04-14T13:44:59,RSSorg,RSS,"डॉ हेडगेवार और डॉ आंबेडकर ने समाज के रोगों का निदान किया - मा भैयाजी जोशी 
@ organiser/Panchajanya sp lissue release function",68,6,98
2015-04-14T13:57:10,RSSorg,RSS,"डॉ आंबेडकर के प्रयास समाज से कुरूतियॉ दूर करने के लिए थे, संघर्ष के लिए नही: मा. भैयाजी जोशी",61,9,86
2015-04-14T13:59:31,RSSorg,RSS,समाज अगर डॉ. अम्बेडकर के सिद्धांतो के आधार पर चला  तो राष्ट्र केलिए  कोई समस्या नहीं होगी: मा भैयाजी जोशी,82,27,124
2015-04-24T06:43:09,RSSorg,RSS,जम्मू और कश्मीर की समस्या को राजनैतिक चश्मे से देखा जाना घातक है: अरुण कुमार जी,46,5,72
2015-04-24T06:44:08,RSSorg,RSS,जम्मू और कश्मीर के लोगों का दुर्भाग्य है कि उनके दर्द को किसी ने सही ढंग से टटोलना उचित नहीं समझा: अरुण कुमार जी,66,2,92
2015-04-24T06:46:19,RSSorg,RSS,जम्मू और कश्मीर के लोग शांतिप्रिय हैं और हिंसा से दूर रहते है | कुछ भागो में सक्रिय अलगाववादीयों को आम जन का समर्थन प्राप्त नहीं: अरुण जी,68,3,107
2015-04-25T17:03:41,RSSorg,RSS,नेपाल मे आये भूकंप में हिन्दू स्वयंसेवक संघ राहत एंव बचाव कार्य में सक्रिय है और भारत से भी स्वयंसेवक नेपाल रवाना हुए है।,777,69,541
2015-04-26T07:08:52,RSSorg,RSS,RSS shares d grief & shock about d devastating Earthquake with d people & expresses deep condolences & prayer for the deceased: Dr. M Vaidya,175,9,150
2015-04-26T07:20:40,RSSorg,RSS,संघ के सह-सरकार्यवाह दत्तात्रेय होसबले नेपाल रवाना। राहत एवं बचाव कार्य का जायजा व नेतृत्व करेंगे।,261,9,163
2015-04-26T07:23:33,RSSorg,RSS,Joint General Secretary reaching Nepal today evening to help HSS Nepal to plan rescue and relief work.,241,13,163
2015-04-26T08:26:30,RSSorg,RSS,Media is reporting inflated figures of RSS Swayamsevaks reaching Nepal for rescue work.,687,75,318
2015-04-26T08:27:05,RSSorg,RSS,RSS Swayamsevaks from Bharat ready to join hands with HSS Nepal after a proper plan is chalked in coordination with Govt of Nepal.,504,18,286
2015-04-27T06:20:45,RSSorg,RSS,Visiting affected areas. Meeting to decide Sewa work at 11 am: Dattatrey Hosabale,96,6,85
2015-04-27T06:21:23,RSSorg,RSS,After visiting affected areas Hosabale to discuss about the rescue and relief work. Meeting in progress at 11.00 am,79,1,83
2015-04-27T06:25:08,RSSorg,RSS,50 doctors of National Medicos Organisation (NMO) to reach Nepal tomorrow to lend medical services.,250,8,157
2015-04-27T06:25:31,RSSorg,RSS,NMO is an organisation of Nationalist medical practitioners inspired by RSS.,209,15,164
2015-04-27T06:31:14,RSSorg,RSS,नेपाल में भूकंप प्रभावित क्षेत्रों का दौरा करने के बाद सह-सरकार्यवाह होसबले जी द्वारा बचाव और राहत कार्य के बारे में चर्चा के लिए बैठक जारी।,135,4,145
2015-04-27T06:37:56,RSSorg,RSS,संघ द्वारा प्रेरित राष्ट्रिय डाक्टर संगठन के 50 डाक्टर चिकित्सा सुविधा देने के लिए कल नेपाल जायेंगें।,311,33,277
2015-04-27T15:27:35,RSSorg,RSS,Sewa International appeals to the benevolent to be generous to provide succor to the Nepal Earthquake affected. http://vskbharat.com/sewa-international-bharat-appeals-for-help-and-support/?lang=en …,198,2,136
2015-04-27T15:28:38,RSSorg,RSS,Your timely contribution will save many and provide relief to thousands. http://vskbharat.com/sewa-international-bharat-appeals-for-help-and-support/?lang=en …,176,9,129
2015-04-27T15:34:05,RSSorg,RSS,#NepalEarthquake Appealing again to contribute generously http://www.sewainternational.org/pc/en/nepal-earthquake-appeal …pic.twitter.com/B7W7sMkAK5,293,26,214
2015-05-10T13:11:16,RSSorg,RSS,"Sri Bindu Madhav Joshi a veteran swayamsevak& a pioneer f Indian consumer movement is no more. May his soul one with the almighty
DR Vaidya",132,27,125
2015-05-25T15:25:30,RSSorg,RSS,Sarkaryavah Bhayaji Joshi is well and will resume tour shortly. He was hospitalised for mdcl checkup following a mild infection - Dr Vaidya,93,24,133
2015-05-28T12:39:45,RSSorg,RSS,Rahul Gandhi's utterances about RSS exposes his frustration & ignorance about RSS- Dr Vaidya 1/2,286,49,275
2015-05-28T12:41:13,RSSorg,RSS,"RSS is experiencing growing admiration support and participation from society, particularly youth- Dr Vaidya 2/2",207,42,243
2015-06-16T04:03:29,RSSorg,RSS,"Sureshji soni underwent angioplasty at Medanta, 2 stents placed. He is stable & recovering. Visitors should refrain visiting-Dr Vaidya",60,23,93
2015-06-18T13:35:13,RSSorg,RSS,We do not see emergency like situation in present scenario in Bharat: Dr Manmohan Vaidya,110,22,123
2015-06-18T15:06:32,RSSorg,RSS,वर्तमान परिदृश्य को देखते हुए आपातकाल लागू करने जैसि स्थिति भारत में है ऐसा नही लगता है :डाँ वैद्य,99,23,142
2015-06-19T12:43:51,RSSorg,RSS,""" Super 30"" students of Anand Kumar scored 25/30 in IIT entrance.. Congrts Anandji for ur cmmtmnt n dedication in bldng the nation.",160,19,176
2015-07-11T15:26:39,RSSorg,RSS,"महिलाओं और तथाकथित शूद्रों के साथ जो कुछ वर्षोँ से हुआ है वह शास्त्र सम्मत नहीं है।
Dr Mohan Bhagvat in Book releasing function@Bhopal 1/3",133,8,134
2015-07-11T15:34:28,RSSorg,RSS,पूरा समाज अपना व्यवहार सही रखता है तब ही देश बड़ा बनता है- Dr Mohan Bhagvat while releasing book 'Mandodari' by Smt Mridula Sunha @Bhopal2/3,137,10,126
2015-07-11T15:37:48,RSSorg,RSS,"माताएं ही मातृभाषा का ज्ञान बच्चों को करा सकती है- Dr Mohan Bhagvat while releasing book, 'Mandodari' written by Smt Mridula Sinha 3/3",159,22,170
2015-07-27T17:34:20,RSSorg,RSS,"APJ, the president of common man ignited minds of young India &gave them a dream to live for. May his soul  rest in eternal peace: Dr Vaidya",311,16,299
2015-07-28T12:28:51,RSSorg,RSS,"""Dr Kalam, A great visionary who ignited innumerable minds."": RSS Sarsanghachalak Dr Mohan Bhagwatpic.twitter.com/KdTiG3KeEN",241,6,176
2015-07-28T12:37:17,RSSorg,RSS,"डॉ. ए.पी.जे. अब्दुल कलाम, असंख्य मनों को प्रकाशित करने वाले दूरदृष्टा : Dr Bhagwatpic.twitter.com/HAHFdZ6avB",176,15,202
2015-08-10T09:18:49,RSSorg,RSS,Krishnappa Ji was a great organiser and inspiration to many Karyakartas & pioneered Kutumb Prabodhan activity in RSS: Dr Manmohan Vaidya,76,7,94
2015-08-15T07:48:07,RSSorg,RSS,"माननीय सरकार्यवाह श्री भय्या जी जोशी ने आज सुबह 7:30 बजे अगरतला, त्रिपुरा स्थित सेवाधाम परिसर में तिरंगा फहराया |pic.twitter.com/kXw3zZPeMJ",132,11,180
2015-08-15T07:49:10,RSSorg,RSS,"कार्यक्रम मे सहसरकार्यवाह श्री दत्तात्रेय होसबोले, डाॅ कृष्णगोपाल जी, त्रिपुरा के कार्यकर्ता और वहाँ के छात्रावास के विद्यार्थी उपस्थित थे |",59,14,108
2015-08-20T14:59:46,RSSorg,RSS,Krishnappaji's saintly life is a role model for all swayamsevaks- Dr Mohan Bhagwat,93,4,108
2015-08-20T15:02:17,RSSorg,RSS,"Krishnappaji used all the negatives and positives happened in his life for the wellbeing of the society
- Dr Bhagwat",91,9,128
2015-09-02T03:07:32,RSSorg,RSS,"'Sabka Saath, Sabka Vikas' should mean affirmative action for all 125 crore Indians: Dr Manmohan Vaidya",123,28,111
2015-09-02T13:44:24,RSSorg,RSS,"RSS samanvay baithak going on smoothly in cordial atmosphere: 
Dr Manmohan Vaidya",74,9,100
2015-09-02T13:51:01,RSSorg,RSS,"Economic scenario of Bharat& measures to improve growth& development were discussed. Many constructive suggestions came up
Dr ManmohanVaidya",81,14,103
2015-09-03T14:15:56,RSSorg,RSS,RSS samanvay baithak today discussed scenario of National security-internal &external besides national educational scenario: Dr MM Vaidya,99,24,111
2015-09-04T08:20:22,RSSorg,RSS,"RSS Samanvay Baithak:-Sah Sarkaryavah Dattatrey Hosabale will address media at 4.00pm
-Dr Manmohan Vaidya",59,10,90
2015-09-04T12:25:51,RSSorg,RSS,Shri Dattatrey Hosabale's press briefing after RSS Samanvay bait yakhttps://m.youtube.com/watch?feature=youtu.be&v=0suYDGWHsso …,88,73,83
2015-09-20T13:45:13,RSSorg,RSS,After debate the constituent assembly decided not to include 'Secular' in the preamble saying it unnecessary in Indian context- Dr Vaidya,131,9,101
2015-09-20T13:56:50,RSSorg,RSS,Art 25 to 30 of our constitution covers everything for minority making 42nd amendment unwanted- Dr Vaidya,107,10,93
2015-09-20T14:01:30,RSSorg,RSS,Still the word secular was forcibly added in the preamble without any demand debate or need during the dark period of emergency- Dr Vaidya,167,9,131
2015-09-20T14:03:27,RSSorg,RSS,"No body tells us why this forcible inclusion? Was it not to start divisive, communal politics - Dr Vaidya",112,8,114
2015-09-20T14:05:00,RSSorg,RSS,In our national polity we were more 'secular' before we became constitutionally secular - Dr Vaidya,246,33,212
2015-10-18T04:33:11,RSSorg,RSS,"Ma Bhaiyaji n Pujya Swami Swaruupananda Saraswati during d Bhumipujan #Shivshaktisangam, P Maharashtra Ekatrikaran Jan3, 2016",59,5,87
2015-10-18T05:41:36,RSSorg,RSS,The report that RSS supports Dadri incident is blatantly false and baseless. RSS never supported any incident of violence- Dr Vaidya,468,31,263
2015-10-18T05:46:50,RSSorg,RSS,RSS has clearly stated abt Dadri violence that a thorough inquiry should be conducted & the guilty should be punished with : Dr Vaidya,365,41,248
2015-10-18T07:45:54,RSSorg,RSS,Paanchajanya/Organiser are not mouth piece of RSS. An official office bearer only speaks on behalf of RSS: Dr Vaidya.,224,23,156
2015-10-20T17:02:40,RSSorg,RSS,समाज के प्रति संवेदना और आत्मीयता ही समाज के प्रति काम करने की प्रेरणा बनती है- Bhaiyaji inaugurating skill dvlpnt cntr for tribal children,97,3,96
2015-10-20T17:12:12,RSSorg,RSS,"समाज के विकास केलिए डाॅक्टर, इंजीनियर के साथ मनुष्य बनाने की आवश्यकता है- Bhaiyaji@Guruji Skill dvlpnt cntr for tribal children Bhivandi 2/5",105,4,110
2015-10-20T17:17:07,RSSorg,RSS,समाज का सुविधाओं से वंचित वर्ग योजनाओं का केन्द्र बिंदु होना चाहिए- Bhaiyji @Bhivandi 3/5,85,4,69
2015-10-20T17:21:54,RSSorg,RSS,देश के विकास के लिए कुटीर उद्योग आधारित विकेन्द्रित व्यवस्था चाहिए- Bhaiyaji @Bhivandi 4/5,81,5,86
2015-10-20T17:28:19,RSSorg,RSS,आज देश में कम पड़े लिखे लोगों के प्रशिक्षण की व्यवस्था निर्माण होना चाहिए- Bhaiyaji @Bhivandi 5/5,81,4,80
2015-10-20T18:28:02,RSSorg,RSS,"Pranams, we'd like to express heartfelt gratitude to you all.
Now, you might've noticed, @RSSorg is verified",352,49,286
2015-10-21T06:26:25,RSSorg,RSS,"#90YearsOfRSS, Silent social revolution, made the hindu society bold enough to say ""Proud Hindu""
Let us celebrate #RSSVijayaDashami tomorrow",798,68,589
2015-10-22T01:26:29,RSSorg,RSS,"Namaskar Hearty Vijayadashami wishes to all
May Parashakti bestow us with Will, Skill and Knowledge 
#RSSVijayaDashami",161,8,149
2015-10-22T02:53:25,RSSorg,RSS,"San ko lekar saat chale ham...
#RSSVijayaDashami",55,3,61
2015-10-22T03:11:52,RSSorg,RSS,"Shanti Ki Aradhana Ki Bhavana jagne lagi
Vijigisha Ki Gamdh lekar Chetana vikasit huyi 
#RSSVijayaDashami",71,4,75
2015-10-22T03:13:23,RSSorg,RSS,RSS is the premier national organisation working for the upliftment of the Nation : Dr VK Saraswat,108,7,99
2015-10-22T03:44:28,RSSorg,RSS,"Pujya Mohanji begins his Vijayadashami boudhik
#RSSVijayaDashami",47,2,59
2015-10-22T03:44:47,RSSorg,RSS,Bharatratna Dr. Babasaheb Ambedkar made a lifelong struggle against the injustice of social inequality #RSSVijayaDashami,88,5,76
2015-10-22T03:47:12,RSSorg,RSS,"Deendayalji Upadhyay, who was nurtured in this technique,had suggested an integral approach called Ekatma Manav Darshan.  #RSSVijayaDashami",96,3,79
2015-10-22T03:53:43,RSSorg,RSS,"Present situation in the country, is very much optimistic and soothing.  #RSSVijayaDashami",105,8,97
2015-10-22T03:54:32,RSSorg,RSS,"An atmosphere of disappointment and lost faith, which existed couple of years back, has evaporated.  #RSSVijayaDashami",79,6,71
2015-10-22T03:55:55,RSSorg,RSS,"Mny proactive stps imprve bilateral reltionshp wth the neighbrng cntries, with succssfulrslts.  #RSSVijayaDashami",60,2,67
2015-10-22T03:57:59,RSSorg,RSS,Bharat reincarntng itslf into a new manifestation N the world is enchanted to see Bharat’snew Avatr with utmost optimism.  #RSSVijayaDashami,74,3,70
2015-10-22T03:59:22,RSSorg,RSS,Devlping nations are lookng frwrd to our leadership to emancipate thmfrm the undsirble inflnce of the so calld wrld pwrs #RSSVijayaDashami,96,2,90
2015-10-22T04:00:20,RSSorg,RSS,"Making Bharatiya mind and soul as the basis, we should adopt whatever is good, truthful & fair from the rest of the world #RSSVijayaDashami",163,6,114
2015-10-22T04:04:34,RSSorg,RSS,"Our ideology and methodology are time tested, why aping west
#RSSVijayaDashami",91,1,82
2015-10-22T04:06:35,RSSorg,RSS,In the manifesto of Niti Ayog the integral Dvlpmnt based on spirituality was mentioned #RSSVijayaDashami,64,0,64
2015-10-22T04:08:06,RSSorg,RSS,"Dharm se jeevan samyit Ho jaata hai
#RSSVijayaDashami",71,0,68
2015-10-22T04:11:27,RSSorg,RSS,"Mudra Bnk, Jan Dhan , cooking gas subsidy srrndr, Swatch Bharat & skill devt are +ve initiatives  - Hlstc & Sust Devt #RSSVijayaDashami",143,2,93
2015-10-22T04:12:11,RSSorg,RSS,"Necssry to hld fruitful dialogues to ensre the participtn of all in the nation bldngexercise, and speed up the execution #RSSVijayaDashami",71,1,72
2015-10-22T04:15:00,RSSorg,RSS,"We've to think seriously abt population, is it a bane or boon
#RSSVijayaDashami",75,8,77
2015-10-22T04:15:59,RSSorg,RSS,We've to make a futuristic plan on the basis of the necessities and resources #RSSVijayaDashami,72,5,78
2015-10-22T04:19:53,RSSorg,RSS,"On the basis of eternal values social changes r to be made, that too with proper discussions wth saints and social leaders
#RSSVijayaDashami",87,3,75
2015-10-22T04:24:56,RSSorg,RSS,"In recent years, Education getting commercialsd N expensive.Beyond the reach of an ordinary citizen. #RSSVijayaDashami",105,2,90
2015-10-22T04:25:29,RSSorg,RSS,Education should be oriented towards fulfilling its goal as well as contemporary requirements of society. #RSSVijayaDashami,81,3,74
2015-10-22T04:26:59,RSSorg,RSS,To ensure that eductn is not commercialized; govt needs to make sure that gov institutions also r run well at all levels. #RSSVijayaDashami,118,18,100
2015-10-22T04:32:31,RSSorg,RSS,Ethical education should be made part of the education policy so as to preserve our social and cultural values intact #RSSVijayaDashami,121,2,101
