timestamp,user,fullname,text,retweets,replies,likes
2014-08-21T12:31:32,RSSorg,RSS,"Namaskar, RSS is officialy entering into the wonderful world of communication. Welcome to all to our official twitter handle.",877,182,528
2014-08-21T18:08:24,RSSorg,RSS,"WE became independent of the British in '47
WE got our constituition in 1950.
This WE is in continuum a personality as nation- Hindu nation",255,28,165
2014-08-21T18:15:29,RSSorg,RSS,People are the nation. This personality in continuum of our nation is known world over as Hindutva which means Hinduness and not Hinduism.,315,41,186
2014-08-22T08:57:45,RSSorg,RSS,The dream that made the scintillating Vivekananda Rock Memorial http://organiser.org/archives/historic/dynamic/modulesfe2d.html?name=Content&pa=showpage&pid=135&page=22 …pic.twitter.com/mDz44kVfjG,258,19,152
2014-08-24T13:01:47,RSSorg,RSS,शहीद शिवराम हरि राजगुरु जी की जयंती पर प्रणाम |pic.twitter.com/naDqAjMp7E,253,23,175
2014-08-27T13:42:52,RSSorg,RSS,Preservation of western Ghat: RSS stands by its ABKM statement- Dattatrey Hosabale,37,3,32
2014-08-27T13:45:58,RSSorg,RSS,Gadgil- Kasturirangan report: RSS opinion is that contentious issues shud b sorted out by consensus of experts: Dattatrey Hosabale,18,1,19
2014-08-27T13:47:29,RSSorg,RSS,Gadgil-Kasturirangan reports: A national debate to evolve consensus is desirable: Dattatrey Hosabale,36,7,26
2014-08-28T00:37:03,RSSorg,RSS,हिन्दू समाज के अस्तित्व को अक्षुण्ण बनाए रखने में संतों की महती भूमिका : सरकार्यवाह,72,14,77
2014-08-28T01:54:41,RSSorg,RSS,"It is our duty to preserve, enrich and pass natural resources to the next generationhttp://vskkerala.com/rss-stands-by-abkm-statement-on-gadgil-kasturirangan-report/ …",66,4,48
2014-08-29T09:40:01,RSSorg,RSS,#GanpatiBappaMorya Happy Ganesh Chaturthipic.twitter.com/Zp7mPlP3VA,251,25,167
2014-08-30T18:35:26,RSSorg,RSS,Provide our students with an education which is beneficial to our nation Dr Mohan Bhagawathttp://vskkerala.com/we-should-provide-our-students-with-an-education-which-is-beneficial-to-our-nationsarasangh-chalak/ …,54,11,67
2014-08-31T07:07:47,RSSorg,RSS,"हम अपने छात्रों को वह शिक्षा दे जो हमारे राष्ट्र की लिये हितकारी हो : पूजनीय मोहन जी भागवत
http://vskkerala.com/we-should-provide-our-students-with-an-education-which-is-beneficial-to-our-nationsarasangh-chalak/ …pic.twitter.com/d9XhyV6zW4",194,36,173
2014-08-31T08:34:33,RSSorg,RSS,"@rajkumartambi Sure, One can join RSS at any age..",2,0,7
2014-09-01T06:42:10,RSSorg,RSS,"More than 1,30,000 RSS inspired service projects  without any gov aid. 
http://vskkerala.com/good-people-should-come-forward-to-understand-the-sanghdr-mohan-bhagwat/ …",116,5,70
2014-09-01T06:51:54,RSSorg,RSS,सज्जन लोगो को संघ को समझने के लिए आगे आना चाहिए : श्री मोहन भागवतhttp://vskkerala.com/good-people-should-come-forward-to-understand-the-sanghdr-mohan-bhagwat/ …,218,19,124
2014-09-01T11:49:24,RSSorg,RSS,Brutal murder of a dedicated worker of RSS in Kannur (Kerala) by frustrated CPM goons. RSS strongly condemns this cowardly act : Dr. Vaidya,295,40,96
2014-09-02T14:26:14,RSSorg,RSS,RSS delegation led by KrishnaGopalji met @BJPRajnathSingh requested to intervene in Kannur murder politics of CPMpic.twitter.com/eZjFTjttA3,266,21,92
2014-09-04T09:11:10,RSSorg,RSS,Kannur murder: Investigation team fears CPM backlash. Independent central agency can only take the investigation to its logical conclusion,182,13,67
2014-09-04T11:45:12,RSSorg,RSS,@RSSorg Malayalmanorama e edition has reported about the fear of police officers.http://bit.ly/Z89VaK ,16,2,22
2014-09-06T14:45:47,RSSorg,RSS,Apocalypse Now at J&K. Flood waters wash away entire villages. Sewa Bharati Volunteers @ ground zero need your help.pic.twitter.com/XN1TE9DkpH,143,6,83
2014-09-06T15:31:31,RSSorg,RSS,Let us extend helping hand to our suffering brethren in J&Khttp://tinyurl.com/k4ek69y ,133,10,51
2014-09-06T15:48:40,RSSorg,RSS,@dvaitadvait1 What do you mean? Have you given away whole J&K to Terrorist? Do you mean that flood has happened in any terrorist camp?,2,10,1
2014-09-07T02:36:02,RSSorg,RSS,"Inspiring life sketch of Yadava Rao Joshi who made RSS strong in south India 
http://bit.ly/1lIFv8U pic.twitter.com/OsM3D0Dopk",89,5,88
2014-09-08T00:16:50,RSSorg,RSS,"OFBJP USA submitted an appeal to Ram madhav ji on the CPM terror against RSS & Bjp in Kannur
http://bit.ly/1qupmVl pic.twitter.com/Cw503eKrs5",79,13,63
2014-09-08T13:17:47,RSSorg,RSS,जब तक समाज में असमानता रहेगी तब तक आरक्षण आवश्यक है:- डॉ मोहन भागवत,65,41,64
2014-09-08T13:22:16,RSSorg,RSS,"उन्हें एक हज़ार साल तक अन्याय और कष्ट सहन करने पड़े है, उनकी स्थिति ठीक होने तक हमें 100 साल तक भी कष्ट सहन करना पड सकता है:- डॉ मोहन भागवत",75,22,62
2014-09-11T06:43:39,RSSorg,RSS,"जाने-माने समाज सुधारक, भारत रत्न श्री विनोबा भावे जी की जयंती पर प्रणाम |pic.twitter.com/AdZnDbV4h6",109,8,105
2014-09-11T06:45:29,RSSorg,RSS,Here is the historic speech delivered by Swami Vivekananda in Chicago in 1893. http://www.belurmath.org/swamivivekananda_works.htm …pic.twitter.com/tjVcdO6BEb,268,15,163
2014-09-11T08:21:46,RSSorg,RSS,हिन्दी भाषा की प्रख्यात कवयित्री महादेवी वर्मा जी की पुण्यतिथि पर श्रधांजलि |pic.twitter.com/joiEkJkmf0,91,10,100
2014-09-15T06:47:34,RSSorg,RSS,Tributes to Bharat Ratna Sir Mokshagundam Visvesvaraya on his birth anniversary.pic.twitter.com/e8E08zlNID,125,11,111
2014-09-24T02:41:06,RSSorg,RSS,"Bharat creates new space history. ISRO confirms end of burn, passes final test. Manglayan declared succesful. Congrats TEAM ISRO",124,12,97
2014-09-25T01:28:31,RSSorg,RSS,नवरात्रि की शुभकामनायेpic.twitter.com/jjd3XWY3N3,174,18,145
2014-09-26T10:13:13,RSSorg,RSS,पर्यावरण प्रदूषण व नशे की समस्या बच्चों को दिए जाने वाले संस्कारों से ही हल होगी | : श्री मोहन भागवत,82,5,76
2014-09-28T16:28:26,RSSorg,RSS,अमर शहीद क्रांतिकारी #BhagatSingh जी की जयंती पर शत् शत् नमन |pic.twitter.com/VTVzlcYppV,78,6,79
2014-10-02T06:01:26,RSSorg,RSS,Preparations nearing completion @Nagpur for the auspicious celebration of #RSSVijayadashmi to be held tomorrow 7.30am,73,8,67
2014-10-02T22:41:45,RSSorg,RSS,"सभी भगिनी, बन्धुवों एवं शुभ चिंतकों को विजयादशमी के मंगलपर्व पर हार्दिक शुभकामनाएं
#RSSVijayadashmi",88,8,69
2014-10-03T01:21:03,RSSorg,RSS,"#RSSVijayadashmi Sanchalan just concluded, function will start sharply @7.30ampic.twitter.com/JKZDdaqwlD",95,8,95
2014-10-03T01:52:17,RSSorg,RSS,"नमस्कार, राष्ट्रीय स्वयंसेवक संघ का विजयादशमी उत्सव कुछ ही समय में शुरू होने जा रहा है. लाइव देखिये http://www.vsknagpur.org 
#RSSVijayadashmi",69,5,59
2014-10-03T02:18:35,RSSorg,RSS,Because of the unabated Sangha Tapasya the whole world has started watching RSS with rapt attention. #RSSVijayadashmi,73,5,60
2014-10-03T02:21:50,RSSorg,RSS,"@ParinVShah No, PT is going on right now. PujaneeyaMohanji will start his Boudhik after this.",4,0,6
2014-10-03T02:28:40,RSSorg,RSS,संघ की शक्तिपूजा #RSSVijayadashmipic.twitter.com/AIAWtHbayh,189,20,183
2014-10-03T03:00:59,RSSorg,RSS,"आज़ादी काफी नहीं, हम को एकता की चरित्र की जरूरत है. संघ वही काम कर रहा है:     Dada vaswani #RSSVijayadashmi",81,3,78
2014-10-03T03:08:59,RSSorg,RSS,"देश का पौरुष जगाये 
आज यह पावन दिवस है
#RSSVijayadashmi",65,7,65
2014-10-03T03:11:07,RSSorg,RSS,"We offer pranams to Great Rajendra chola, whose millennium year is celebrating this year. Dr Bhagavatji in  #RSSVijayadashmi",79,3,62
2014-10-03T03:11:54,RSSorg,RSS,The grand success of Mangalyaan has tremendously generated respect for us &has added to our self respect. #RSSVijayadashmi,58,4,60
2014-10-03T03:13:13,RSSorg,RSS,Hearty congrats to one and all athletes who made nation proud by winning medals in the Asiad: Dr Bhagavatji in #RSSVijayadashmi,90,3,74
2014-10-03T03:20:45,RSSorg,RSS,"Bharateeya diaspora is exhibiting enthusiasm & resolve towards the Motherland.
#RSSVijayadashmi",68,8,51
2014-10-03T03:22:07,RSSorg,RSS,Selfish interests by the western countries are responsible for  terrorism emerged today in the form of ISIS.#RSSVijayadashmi,87,6,46
2014-10-03T03:25:09,RSSorg,RSS,"Arrogance, egoism, fanaticism shown in the conduct among individuals or nations are the real cause of the Global crisis. #RSSVijayadashmi",81,3,52
2014-10-03T03:27:06,RSSorg,RSS,Bharat has been the only eg which has made genuine efforts in this direction through the path of truth and non-violence.#RSSVijayadashmi,82,4,54
2014-10-03T03:28:35,RSSorg,RSS,"Respect and acceptance of each other’s faith, harmony and cooperation is the hall mark speciality of Hindu Culture.#RSSVijayadashmi",144,7,86
2014-10-03T03:30:40,RSSorg,RSS,"Without attmptng to conqr any empire, Rishis & Munis shared  Bharatiya ethos of love, affection and universal welfare. #RSSVijayadashmi",147,3,96
2014-10-03T03:32:40,RSSorg,RSS,"(1) To the hungry babies of this world, I've fed blood from my heart,
#RSSVijayadashmi",55,2,45
2014-10-03T03:33:32,RSSorg,RSS,"(2) Not others' lands, I'm determined to conquer innumerable hearts !
#RSSVijayadashmi",51,3,45
2014-10-03T03:37:38,RSSorg,RSS,New government is not even six months old. But positive signs are emanating from time to time which give hope #RSSVijayadashmi,92,9,66
2014-10-03T03:40:21,RSSorg,RSS,Emergence of strong Bharat on the international horizon. Fulfilling the aspirations of the common Bharateeya #RSSVijayadashmi,63,2,55
2014-10-03T03:41:43,RSSorg,RSS,It is our duty to keep our surroundings clean #RSSVijayadashmi,79,8,59
2014-10-03T03:47:43,RSSorg,RSS,Gov'll 've to evolve a suitable development path which suits our current situation #RSSVijayadashmi,51,6,46
2014-10-03T03:50:08,RSSorg,RSS,"Jihadi atrocities are increasing alarmingly in TN &Kerala, concerned govts' there are not taking actions effectively #RSSVijayadashmi",119,12,68
2014-10-03T03:56:23,RSSorg,RSS,"society too has to play an important role in meeting the challenges . society needs to b aware towards tackling issues 
#RSSVijayadashmi",80,9,66
2014-10-03T03:59:31,RSSorg,RSS,"फौज में अफसरों की कमी है, क्या समाज में नवयुवकों की कमी है? सुधारने का दायित्व किस का है? #RSSVijayadashmi",93,14,83
2014-10-03T04:05:43,RSSorg,RSS,Make sure that the atmosphere in our family life is suitable for giving right kind of training to our children #RSSVijayadashmi,112,8,92
2014-10-03T04:13:12,RSSorg,RSS,"Ensure that all Hindus shud participate in all functions, celebrations as well as festivals of great heroes &personalities.
#RSSVijayadashmi",95,3,80
2014-10-03T04:15:34,RSSorg,RSS,The all inclusive and all encompassing truth is what we call Hinduness. It is our national identity #RSSVijayadashmi,110,8,75
2014-10-03T06:52:40,RSSorg,RSS,"More than 10 private chnls covered #RSSVijayadashmi live, it shows  ppls interest in knowing what RSS speaks on Vijaydashmi.",192,24,145
2014-10-03T07:03:10,RSSorg,RSS,"if ppl aspire to know what RSS speaks on Vijayadashmi, it is quite natural for any channel to cover it, so DD too covered #RSSVijayadashmi",209,38,154
2014-10-05T11:19:30,RSSorg,RSS,"@VedForNaMo Sorry for the delay, Lalitji will be in touch with you..",2,4,7
2014-10-07T06:18:26,RSSorg,RSS,"Remembering the great occassion of Kerala Prant Sanghik. Feel the strength of organisation and discipline.
http://bit.ly/ZrxM4U ",48,6,58
2014-10-09T15:53:19,RSSorg,RSS,The void occurred due to passing away of Sri Kamat will remain un filled in the field of journalism for a long period. : Dr Vaidya,40,3,50
2014-10-09T23:15:40,RSSorg,RSS,Sri MVKamath contested secularist world both during worst days n the best time of our movmnt May his soul rest in peace:Dattatreya Hosabale,49,2,45
2014-10-10T04:20:10,RSSorg,RSS,"#RSSVijayadashmi Oct 3, 2014http://youtu.be/TyKALbruZZs ",28,3,58
2014-10-10T16:16:37,RSSorg,RSS,Congrats Kailashji being awarded the Nobel peace prize. May your tireless efforts for children inspire millions.the nation is proud of you.,98,7,96
2014-10-14T07:16:05,RSSorg,RSS,हिंदुत्व ही भारतवर्ष की आत्मा है : सहसरकार्यवाह श्री सुरेश सोनी जी बजरंग दल के राष्ट्रीय अधिवेशन में |pic.twitter.com/APhaRWMCLt,120,16,123
2014-10-16T07:19:37,RSSorg,RSS,ABKM. Dr Manmohan Vaidya will brief the press about ABKM at 4.30 PM today (15. 10. 2015),16,1,25
2014-10-16T07:22:14,RSSorg,RSS,"Dr Manmohan Vadya will brief press about Akhil Bharateey Karyakari Mandal at 4.30pm today (16. 10. 2015).
Venue: Sarswati Kunj, Nirala Nagar",23,1,31
2014-10-16T07:29:59,RSSorg,RSS,"Dr Manmohan Vaidya will brief press about ABKM today(16.10.2014) at 4.30pm
Venue: Saraswati Kunj, Nirala Nagar",27,0,31
2014-10-16T08:24:24,RSSorg,RSS,Guha&comrades wr agitated on Livetelecast of #rssvijayadashmi bcz  untruths spewed by them against RSS wl b exposed as ppl know RSS directly,93,11,57
2014-10-16T09:21:03,RSSorg,RSS,संघ का भाषण DDपर सीधा प्रसारित करने पर गुहा जैसे वामपंथी उद्वेलित हुए कारण संघ की बात लोग सीधा समझ सकेंगे तो उन का झूठ खुला होगा : Dr Vaidya,180,12,112
2014-10-16T14:18:20,RSSorg,RSS,"भारत में कोई अल्पसंख्य नहीं है, यहां रहनेवाले सभी लोगों का सांस्कृतिक मूल एक है- 
डां:  मनमोहन वैद्य",190,19,145
2014-10-16T14:26:56,RSSorg,RSS,"@James_KSA Bharat has a unique view of life which is holistic, integral n spirituality based. We all share it with pride",3,1,4
2014-10-16T14:36:18,RSSorg,RSS,"@James_KSA By all means ji,",2,1,5
2014-10-17T05:09:07,RSSorg,RSS,#RSSABKM सामान्य जन का जीवन स्तर ऊंचा उठाने के कार्य को वरीयता देना स्वाभाविक ही है: दत्तात्रेय होसबाले,40,1,42
2014-10-17T05:09:18,RSSorg,RSS,#RSSABKM चुनाव के समय दिए वचन पूर्ण करने की वरीयता सरकार को तय करनी है: दत्तात्रेय होसबाले,41,0,49
2014-10-17T05:09:24,RSSorg,RSS,"#RSSABKM बचाव एवं राहत कार्य के समय जाती या मजहब न देखकर जो त्रस्त है, उनकी सहायता करने की संघ की परंपरा है: दत्तात्रेय होसबले",48,3,54
2014-10-17T05:09:31,RSSorg,RSS,"#RSSABKM कश्मीर घाटी, जम्मू, मेघालय, विशाखपट्टनम सभी जगह स्वयंसेवक तत्परता से बचाव एवं राहत कार्य में जुट गए थे: दत्तात्रेय होसबले",53,0,50
2014-10-17T05:18:13,RSSorg,RSS,"#RSSABKM In Kashmir valley, Jammu, Meghalya and Vishakhapatanam swayamsevaks rushed for rescue and relief activities.",120,4,51
2014-10-17T05:21:51,RSSorg,RSS,#RSSABKM Govt. has to decide priority in fullfilling the promises declared in party's election manifesto.,24,4,35
2014-10-17T05:26:03,RSSorg,RSS,#RSSABKM Resolving the daily lively hood problems of common man taking priority by govt. is quite natural.,31,1,33
2014-10-17T07:20:16,RSSorg,RSS,"Decision taken by DD authorities to telecast live #rssvijayadashmi proved correct, record viewership on that day
http://bit.ly/1qGwJVZ ",78,7,74
2014-10-17T07:30:31,RSSorg,RSS,@deepakusingh विजय जनता जनार्दन की,3,1,9
2014-10-17T14:21:24,RSSorg,RSS,"सरसंघचालक के भाषण के प्रसारण के समय दूरदर्शन की trp सर्वाधिक थी | यह बताता है, दूरदर्शन का निर्णय योग्य था |",151,14,134
2014-10-17T14:24:10,RSSorg,RSS,"सरकार को जनता चुनती है | 
जनता जो देखना चाहती है वह दिखाना सरकार का स्वाभाविक दायित्व बनता है |",109,20,106
2014-10-18T08:19:11,RSSorg,RSS,"Q: Will #ABKMRSS discuss border situation 
Dattaji : ""No; Govt has acted well & all welcomed it. Let the other side of the border discuss""",42,7,41
2014-10-19T00:57:57,RSSorg,RSS,#RSS relief activities in hudhud affected areahttp://bit.ly/1sZoCsz ,76,8,63
2014-10-20T04:41:41,RSSorg,RSS,"#RSSABKM concluded
Sarkaryavah Surash(Bhaiyya)joshiji's press conference today (20.10.2014)
@12.30 
Venue: Saraswatikunj, Niralanagar",21,4,32
2014-10-20T04:46:17,RSSorg,RSS,"लखनऊ में संपन्न #rssabkm की बैठक के उपलक्ष्य में सरकार्यवाह श्री भैयाजी की पत्रकार वार्ता आज 20 अक्टूबर, 12.30 को आयोजित है",30,2,47
2014-10-21T01:25:45,RSSorg,RSS,RSS to mark millennium of Rajendra Chola - The Hinduhttp://www.thehindu.com/news/national/tamil-nadu/article6520437.ece …,80,5,74
2014-10-21T05:28:40,RSSorg,RSS,"अपना व्यक्तिगत-राष्ट्रीय जीवन हिंदुत्व के आलोक में शुचिता, अनुशासन  एवं कर्तव्यबोध  के प्रकाश से आलोकित हो शुभ दीपावली |
डा. मोहन भागवत",134,23,137
2014-10-21T13:54:16,RSSorg,RSS,"Let Deevaali illuminate our path to purity, discipline n dutifulness in our individual n national life in the light of Hinduness
-Dr Bhagwat",159,16,150
2014-10-23T08:53:00,RSSorg,RSS,टी वी देशमुखजी (क्षेत्र संघचालक) के देहावसान पर अत्यंत दू:ख की अनुभूति. परमात्मा से प्रार्थना है की दिवंगत आत्मा को अपने चरणो में स्थान दे,47,14,66
2014-10-23T09:43:23,RSSorg,RSS,"TVDeshmukhji's possessions including robust personality n sensitive heart were always at the disposal of RSS to serve the nation.
Dr Bhagwat",35,2,58
2014-10-25T08:07:15,RSSorg,RSS,"RSS strongly condemns the controversial article published in Kesari. we are against any kind of violence in thought or action.
Dr Vaidya",66,4,53
2014-10-25T08:22:48,RSSorg,RSS,"RSS has nothing to do with the views expressed in the controversial article written by B. Gopalkrishnan apeared in Malyalam weekly ""kesari""",108,4,82
2014-10-25T08:49:30,RSSorg,RSS,"RSS condemns the views expressed in the article published in Kesari. We always dissaproved any thought or act of violence.
Dr Vaidya",126,10,91
2014-10-28T11:52:42,RSSorg,RSS,Swargiya T.V.Deshmukh is an Ideal Swyamsevak - Bhayyaji Joshipic.twitter.com/oWgQ68DLp4,36,6,85
2014-10-31T08:48:00,RSSorg,RSS,Bharat is existing today to think n talk about is due to Sardar Patel’s statesmanship firm administration n true Nationalistic vision,105,17,94
2014-11-02T02:46:01,RSSorg,RSS,"What we r witnessing r the first small steps of a corrective process, an attempt 2 rescue past frm d clutches of ideological regimentation.",87,11,73
2014-11-02T03:22:08,RSSorg,RSS,"@drgauravdhawan9 straight way go to any Shakha of RSS nearby and that's it, no official formality. Visit http://rss.org ",16,2,17
2014-11-04T10:35:20,RSSorg,RSS,देश बदलना है तो खुद को बदलो -- मोहन भागवत।,141,15,151
2014-11-04T10:41:45,RSSorg,RSS,बड़ी बातें नहीं बड़े काम करो। इस लिए जिम्मेदारी सम्भालो और समझो कि आपके किये बगैर कुछ नहीं बदलेगा : Dr Bhagwat,162,0,154
2014-11-05T13:45:36,RSSorg,RSS,RSS Karnataka Greets veteran Pracharak K Suryanarayana Rao (Suruji) on his 90th Birthday http://samvada.org/2014/news/suruji-90/ …pic.twitter.com/k0nOJdG5Hk,62,8,84
2014-11-06T02:15:31,RSSorg,RSS,कार्तिक पूर्णिमा के पवन अवसर पर सभी देशवासियों को हार्दिक शुभ कामनाएं,110,20,110
2014-11-13T06:59:30,RSSorg,RSS,Hearty congrats to Just: Krishna Iyer Ji. Upright n just persons like him are icons n mainstay of character of our nation.  Dr Bhagwat.,43,7,67
2014-11-19T03:55:09,RSSorg,RSS,Nation remembers Sri Eknathji Ranade on his jayantihttp://samvada.org/2014/news/ekanath-ranade-100th-birthday/ …,35,4,53
2014-11-19T04:02:49,RSSorg,RSS,"""Krinvanto Viswamaaryam"" is Bharat's life mission
http://bit.ly/1p0IJX4 ",32,3,37
2014-11-19T08:07:14,RSSorg,RSS,"खूब लड़ी मर्दानी वह तो झाँसी वाली रानी थी...
Respectful pranams to Rani Lakshmibai on her birth anniversary.",111,10,111
2014-11-19T08:35:25,RSSorg,RSS,"@gary_1980in By, सुभद्रा कुमारी चौहान",3,2,14
2014-11-19T09:03:32,RSSorg,RSS,@gary_1980in http://bundelkhand.in/portal/POEM/khoob-ladi-mardani-woh-to-jhansi-wali-rani-thi …,1,1,7
2014-11-20T02:37:51,RSSorg,RSS,"Kerala HC issued summons against Matrubhumi daily, for it published a deregotery article agaist RSShttp://vskkerala.com/defamation-case-was-filed-against-mathrubhumi/ …",98,9,90
2014-11-20T06:18:15,RSSorg,RSS,@CanfuseBird A Swayamsevak of Kerala filed a case,2,1,8
2014-11-21T15:32:38,RSSorg,RSS,"समस्त संसार को मानवता का पाठ पढ़ाने का परंपरा से भारत का दायित्व है, जिसकी आवश्यकता संसार को सदा रहेगी
Dr Bhagwat",134,20,116
2014-11-21T15:34:41,RSSorg,RSS,Best wishes for World Hindu Congresspic.twitter.com/Os6Y4I01rf,211,33,240
2014-11-23T11:10:33,RSSorg,RSS,Bharat Parikrama Yatra enters Gou Raksha Pranth; Baba Seetaramji inspires villagers for ‘Gram Vikas’http://samvada.org/2014/news/day-836-bpy/ …,50,7,66
2014-11-23T12:02:28,RSSorg,RSS,"“They alone live, who live for others.”
Seva Samgamam organised by Sevabharati @Guntur concludespic.twitter.com/MU93OpXhit",70,9,95
2014-12-02T01:40:47,RSSorg,RSS,We strongly condemn yesterday's cowardly attack of Maoists in Chattisgarh in which 14 of our brave hearts were martyred.,87,16,71
2014-12-02T02:05:51,RSSorg,RSS,छत्तीसगढ़ में सी.आर.पि.ऍफ़ के बहादुर जवानों पर माओवादियों के डरपोक हमले की कड़ी भर्त्सना- डा: वैद्य,44,3,68
2014-12-02T06:42:06,RSSorg,RSS,"On this blessed Geeta Jayanti, may we all live the Geeta way of life 'Perform your obligatory duty, action is indeed better than inaction'",70,2,55
2014-12-02T06:45:12,RSSorg,RSS,"On this blessed #GeetaJayanti may we all live the Geeta way of life 'Perform your obligatory duty, action is indeed better than inaction'",89,11,78
2014-12-03T06:15:30,RSSorg,RSS,"An exemplary Shakha @Anandappilli in Telengana, 
read in details inhttp://samvada.org/2014/news/shakha-at-anandapalli/ …",31,3,53
2014-12-04T12:36:38,RSSorg,RSS,With the passing away of Justice V.R. Krishna Iyer we have lost a great jurist: Dr. Mohan Bhagwatpic.twitter.com/q9DytSI744,86,4,98
2014-12-04T12:37:04,RSSorg,RSS,He had made seminal contributions to turn our judicial system into a vehicle for social justice: Dr. Mohan Bhagwat,29,1,38
2014-12-04T12:39:27,RSSorg,RSS,"A great humanist, and he will be remembered for his contribution for social betterment: Dr. Mohan Bhagwat",37,1,42
