timestamp,user,fullname,text,retweets,replies,likes
2014-12-04T13:10:22,RSSorg,RSS,"It was only recently I had an opportunity of meeting Just: Iyer, which was an invigorating experience for me. 
Dr Mohan Bhagwat",41,3,59
2014-12-06T10:13:04,RSSorg,RSS,"RSS Sarkaryavah Bhaiyaji Joshi offering floral tributes to Dr Ambedkarji.
http://rsschennai.blogspot.in/2014/12/nation-remembers-drambedkar-punyathithi.html …pic.twitter.com/EPL4cLSvIB",60,3,69
2014-12-06T10:24:21,RSSorg,RSS,"RSS Sarkaryavah Bhaiyaji Joshi offering floral tributes to Dr Ambedkarji.
http://rsschennai.blogspot.in/2014/12/nation-remembers-drambedkar-punyathithi.html …pic.twitter.com/94Y5PrCl8L",43,3,61
2014-12-06T10:26:12,RSSorg,RSS,"RSS Sarkaryavah Bhaiyaji Joshi offering floral tributes to Dr Ambedkarji.
http://rsschennai.blogspot.in/2014/12/nation-remembers-drambedkar-punyathithi.html …pic.twitter.com/Iim8qvD8uo",63,6,93
2014-12-06T10:26:30,RSSorg,RSS,"RSS Sarkaryavah Bhaiyaji Joshi offering floral tributes to Dr Ambedkarji.
http://rsschennai.blogspot.in/2014/12/nation-remembers-drambedkar-punyathithi.html …",37,13,70
2014-12-16T09:40:37,RSSorg,RSS,We strongly condemn the savagery of #Peshawar Monsters,196,20,140
2014-12-19T06:20:56,RSSorg,RSS,"Remembering stars of revolutionaries, Ramprasad Bismil & Ashhaqullah Khan on their great martyrdom day #dec 19",106,6,102
2014-12-20T03:23:20,RSSorg,RSS,"सेवा इस देश की परंपरा है, धर्म याने अपने समाज के प्रति कर्तव्य की भावना से होती है: Bhaiyaji (Sarkaryavah)pic.twitter.com/B8Z4byTznI",110,11,120
2014-12-20T03:40:03,RSSorg,RSS,RSS Sarsanghchalk Dr. Mohan Bhagwat will address Vanvasi Raksha Parivar Kumbha in Delhipic.twitter.com/ixe3LKwxh2,115,9,119
2014-12-21T03:21:19,RSSorg,RSS,"श्री गुरु तेग बहादुर के शीश वापस लाने वाले ""रंघरेटे गुरु के बेटे"" भाई जैता जी के शहीदी दिवस/वीर योद्धा को प्रणामpic.twitter.com/i6obzC6MQK",211,25,205
2014-12-22T05:39:27,RSSorg,RSS,"Remembering the mighty lion of Hindustan, Guru Govind Singh on his birthday who fought till death to protect nation.pic.twitter.com/9W8emduPUj",242,17,189
2014-12-22T13:07:53,RSSorg,RSS,"If you're against conversion, bring law against it: Dr Bhagwathttp://youtu.be/Ojjj4yu_8xg ",171,36,150
2014-12-22T15:08:32,RSSorg,RSS,If there is no Shakha nearby do visit http://rss.org  & through JoinRSS facility make active contact with Sangh workers of your area,133,12,102
2014-12-24T07:00:04,RSSorg,RSS,We are happy to state that BharatRatna to Atalji & Malavyaji is a recognition of ideals & life of these great souls dedicated to the nation,128,11,157
2014-12-24T07:15:47,RSSorg,RSS,मा अटलजी एवं पं मालव्यजी को भारतरत्न से सम्मानित करने से उनके जीवनादर्श एवं राष्ट्रसमर्पित जीवन का सम्मान हुआ है - डा: वैद्य,97,5,127
2014-12-25T04:13:02,RSSorg,RSS,"सर्वोदय तभी संभव है जब राष्ट्रीय चरित्र भोगमयी न होकर त्याग की भावना से परिपूर्ण हो।
RSS SahSarkaryavah DattaHosabalehttp://www.jagran.com/uttar-pradesh/gorakhpur-city-11911160.html …",102,12,119
2014-12-26T06:12:05,RSSorg,RSS,Tributes to Revolutionary Freedom fighter Sardar Udham Singh on his birth anniversary.pic.twitter.com/McMmbBxAWB,158,16,150
2014-12-26T06:24:35,RSSorg,RSS,आज छोटे साहिबजादे और माता गुजरी का शहीदी दिवस है | इनके बलिदान को यह राष्ट्र सदा स्मरण करता रहेगा |pic.twitter.com/al1SWyS3nB,118,6,123
2014-12-27T06:06:50,RSSorg,RSS,भारत की संस्कृति में सेवा जीवनशैली का अभिन्न अंग है: भय्या जी  @दिव्य प्रेम सेवा मिशन हरिद्वारpic.twitter.com/lsRkL69vdr,70,7,116
2014-12-28T11:21:43,RSSorg,RSS,अब समाज के विघटन का समय समाप्त हो गया है। अब हम उत्थान की ओर चल पड़े हैं। । RSS Sarkaryavah Bhaiyaaji @vhp mtgpic.twitter.com/m7ShVNEq7G,99,10,142
2014-12-28T11:40:20,RSSorg,RSS,"सबसे पहले तो हमें विकास को ही पुनर्परिभाषित करना होगा 
-Bhaiyaji @भारतीय शिक्षण मंडल और वीर नर्मद विश्विद्यालय सूरतpic.twitter.com/SSrZymW3B3",66,7,106
2014-12-28T11:43:11,RSSorg,RSS,"First of all we've to redefine the very concept 'Development'
-Bhaiyaji @ shikshan Mandal & Narmada University Suratpic.twitter.com/1DReUlJmLi",60,9,87
2014-12-28T11:49:34,RSSorg,RSS,"The time of disintegration has gone, Now we're marching ahead towards Renaissance-  Bhaiyaji @VHP mtgpic.twitter.com/g0mCvR1WpU",106,15,140
2015-01-02T13:49:27,RSSorg,RSS,"Bharatiya samskruti is ancient as well as modern-Soniji
http://www.vskgujarat.com/ भारतीय-संस्कृति-चिर-पुरा/
#RSScampgujpic.twitter.com/0a78NFUaVk",61,1,83
2015-01-02T13:51:21,RSSorg,RSS,"RSS Sarkaryavah Ma Bhaiyaji Joshi inaugurated the mammoth Karyakartha shibir of Gujarat
#RSScampguj",35,0,56
2015-01-02T13:57:44,RSSorg,RSS,"Positive change started 90yrs back in our great nation has gained momentum now and Bharat is becoming ViswaGuru again- Bhaiyaji
#RSScampguj",42,11,66
2015-01-02T16:55:05,RSSorg,RSS,#RSScampgujpic.twitter.com/3OiTerSpHi,55,2,85
2015-01-02T16:57:25,RSSorg,RSS,#RSScampgujpic.twitter.com/AaxhyXgZcJ,53,3,98
2015-01-03T01:07:01,RSSorg,RSS,"INTERVIEW: HOMECOMING IS A NATURAL URGE TO RECONNECT TO ROOTS—DR MANMOHAN VAIDYA
http://organiser.org//Encyc/2014/12/27/Interview--Homecoming-is-a-natural-urge-to-reconnect-to-roots …—Dr-Manmohan-Vaidya.aspx",42,13,52
2015-01-03T02:11:26,RSSorg,RSS,@RSSorg Please go straight to http://organiser.org  for reading Manmohanji's interview on #gharvapasi if the link is not opening.,27,2,38
2015-01-03T05:45:17,RSSorg,RSS,"Dr Manmohan Vaidya will address press at 11.15
Venue:Shibir parisar
#RSScampguj",35,0,43
2015-01-03T06:04:58,RSSorg,RSS,"Dr Vaidyaji is addressing the press #RSScampguj
14558 workers are participating in the camp.pic.twitter.com/99yVEwNyaL",52,12,74
2015-01-04T11:12:57,RSSorg,RSS,#RSScampguj valedictory function begun. After demonstration of PT now Prant Karyavah Yashwant Bhai Choudhary delivering the welcome address,25,0,30
2015-01-04T11:15:01,RSSorg,RSS,Dr Mohanji Bhagwat will address the mega rally within minutes #RSScampguj,33,3,51
2015-01-04T11:18:16,RSSorg,RSS,Pujya Swami Sadanandji (Shankaracharya Swaroopanandji maharaj's shishya) has started his benedictory address @ #RSScampguj,38,3,41
2015-01-04T11:19:58,RSSorg,RSS,"we got this birth as a human being to fulfill certain sacred purpose
Pujya Sadanandji Maharaj #RSScampguj",35,0,46
2015-01-04T11:26:46,RSSorg,RSS,if someone is at loss because of conversion they are Hindus. we all should come together and work against this aggression. #RSScampguj,108,7,72
2015-01-04T11:29:14,RSSorg,RSS,@MaverickLG http://www.vskgujarat.com/livestreaming ,1,0,6
2015-01-04T11:32:08,RSSorg,RSS,"it is our duty to protect and preserve our culture, that is our Dharma_ Pujya Sadanandji Maharaj #RSScampguj",61,3,64
2015-01-04T11:34:03,RSSorg,RSS,our brother who was lost in the jungle is now returning to his own home. Gharvapasi is just that- Pujya sadanandji #RSScampguj,74,6,68
2015-01-04T11:36:18,RSSorg,RSS,"Powerful Government has come in the center, no doubt our Manabindus will be saved- Pu Sadanandji #RSScampguj .",41,3,48
2015-01-04T11:37:45,RSSorg,RSS,Go Raksha and Common civil code are the need of the hour- Sadanandji Maharaj #RSScampguj,67,5,63
2015-01-04T11:40:59,RSSorg,RSS,"VyaktiGeet begun, ""Sangh Badta Jaa Raha Hai.."" #RSScampguj",34,2,48
2015-01-04T11:44:09,RSSorg,RSS,Vijay Path Par Hindu Agrasar badta jaa raha hai #RSScampguj,39,2,54
2015-01-04T11:48:49,RSSorg,RSS,"The problems which the whole humanity now facing is because of the negligence of Dharma- Dr Bhagwat
#RSScampguj",76,1,71
2015-01-04T11:51:15,RSSorg,RSS,"Many attempts were experimented here to solve the crisis but all failed, now they are all turning towards Dr Bhagwat  #RSScampguj",44,0,48
2015-01-04T11:52:49,RSSorg,RSS,"We Hindus are the pioneers -Dr Bhagwat 
#RSScampguj",67,3,71
2015-01-04T11:59:45,RSSorg,RSS,Dr Hedgewar thought about the weakness of our nation and discussed the issue with all true nationalists-Dr Bhagwat  #RSScampguj,59,0,56
2015-01-04T12:03:38,RSSorg,RSS,"Tilakji, Netaji, Savarkarji etc. all were of same opinion. National consciousness level should be raised. #RSScampguj",92,4,85
2015-01-04T12:05:38,RSSorg,RSS,"This nation is HinduRashtra. Our approach towards others was based on universal acceptance not mere tolerance-Dr Bhagwat
#RSScampguj",149,11,114
2015-01-04T12:07:10,RSSorg,RSS,"'Sarva Deva namaskaram keshavam pratigachati' is HIndu thought. Dr Bhagwat
#RSScampguj",74,4,73
2015-01-04T12:11:14,RSSorg,RSS,"Our identity was formed on the basis of the experiences of great Rishis, that is known as Hindutva. Dr Bhagwat
#RSScampguj",92,3,91
2015-01-04T12:14:02,RSSorg,RSS,"This great work of RSS has got only one aim, to take our nation to the pinnacle of glory, nothing short of that- Dr Bhagwat
#RSScampguj",159,9,124
2015-01-04T12:27:05,RSSorg,RSS,"We are doing physical exercises to develop sacred values, we havent got an iota of enmity towards anyone. Dr Bhagwat
#RSScampguj",102,5,97
2015-01-04T12:29:13,RSSorg,RSS,"one should come near and inside Sangh to know about Sangh. Dr BHagwat
#RSScampguj",149,14,123
2015-01-06T14:57:31,RSSorg,RSS,"Educated are making majority of the problems now a days not the uneducated. Edn system is responsible. Correction is needed.
-Bhaiyaji",112,32,118
2015-01-12T01:47:18,RSSorg,RSS,स्वामी विवेकानंद जयंती की हार्दिक शुभ कामनाएं,150,25,176
2015-01-12T12:30:47,RSSorg,RSS,"View from the sky, Devagiri Samgamam. Prant Ekatrikaran of RSS Devagiri Prant.pic.twitter.com/yIfPqNvWMJ",164,16,166
2015-01-14T02:24:21,RSSorg,RSS,"Best wishes on the sacred beginning of Uttarayan. 
May the warmth of mutual love and light of wisdom grow incessantly",81,9,96
2015-01-14T05:57:43,RSSorg,RSS,"""संघ अगर किसी का विरोधी है तो वह है हिंदु समाज में व्याप्त बुराईयों का"" भय्या जोशी @विवेकानन्द व्याख्यान मालाpic.twitter.com/JnpndPNXwf",116,9,129
2015-01-14T23:48:30,RSSorg,RSS,संघ का प्रारंभ हिंदु समाज को संगठित और हिंदु समाज में आई विकृति को दूर कर निर्दोष करने के लिए हुआ है- Bhaiyaji @makarasankranti Malkapur,78,9,96
2015-01-14T23:50:34,RSSorg,RSS,हिंदु के उत्थान और पतन से देश का उत्थान और पतन जुड़ा है Bhaiyaji @makarasankranti Malkapurpic.twitter.com/lIdr3n6dZO,61,1,97
2015-01-14T23:55:31,RSSorg,RSS,"आज हिंदु समाज अपने दर्शन और चितन से विपरीत व्यवहार कर रहा है
Bhaiyaji @makarasankranti Malkapur",41,4,76
2015-01-14T23:56:58,RSSorg,RSS,"सब में ईश्वर के वास को मानने वाला हिंदु समाज आज जातिगत,भाषाई और प्रांत-क्षेत्र के संकुचित व्यवहार में लगा है
Bhaiyaji @malkapur",61,8,91
2015-01-14T23:57:32,RSSorg,RSS,"प्रकृति को पूजने वाला ही नदियों-भूमि को प्रदूषित कर रहा है
Bhaiyaji @makarasankranti Malkapur",58,4,89
2015-01-14T23:58:54,RSSorg,RSS,"हिंदु समाज को अपना व्यवहार आदर्श बनाना होगा तभी भारत और विश्व का कल्याण होगा
Bhaiyaji @malkapur",84,13,111
2015-01-15T11:40:45,RSSorg,RSS,"RSS ideologue Ranga Hariji's article on #Gharvapasi
http://www.vicharvimarsh.com/2015/01/15/what-are-the-undercurrents-for-ghar-vapsi/ …",45,4,60
2015-01-17T07:52:34,RSSorg,RSS,"News about Dr Bhagwatji disapproving KiranBedi's entry to BJP is baseless. Its an evil design to show a rift between RSS &Govt.
Dr M.Vaidya",607,51,281
2015-01-17T08:03:41,RSSorg,RSS,किरण बेदी के भाजपा प्रवेश पर डॉ भागवत नाराज है यह समाचार निराधार  है यह मिडिया का संघ और सरकार में दरार दिखाने का षडयंत्र है- डॉ वैद्य,517,47,342
2015-01-22T09:40:15,RSSorg,RSS,US court summons secy John Kerry in a petition to designate RSS as a terror group.http://zeenews.india.com/news/india/petition-filed-in-us-court-to-designate-rss-as-terror-group_1534439.html …,77,32,70
2015-01-23T03:51:57,RSSorg,RSS,We pay tributes to Netaji the great son of Hindustan who stands out in all distinctiveness & a class by himself.,120,20,122
2015-01-23T10:19:57,RSSorg,RSS,हिन्दुधर्म याने मानवधर्म है : पूजनीय मोहन जी भागवत  @ठिमार्णि व्याख्यान माला,70,12,94
2015-01-23T13:23:04,RSSorg,RSS,"RSS Tamilnadu condemns the comments made by Shri Dayanidhi Maran on RSS
VISIT: http://rsschennai.blogspot.com/ ",63,15,73
2015-01-24T06:28:05,RSSorg,RSS,वसंत पंचमी की शुभकामनाएंpic.twitter.com/APnHrFY2Wi,118,8,178
2015-01-24T15:32:06,RSSorg,RSS,"भारत में भोग नहीं त्याग की कहानी चलती है
Dr Bhagavatji @Devadhar Ekatreekran jharkhand",67,6,105
2015-01-24T15:49:34,RSSorg,RSS,"भाषण सभी कर सकते है लेकिन आचरण कठिन है- डॉ मोहनजी भागवत
@Devadhar",99,15,130
2015-01-24T15:55:36,RSSorg,RSS,देश केलिए निस्वार्थ कार्य करने की प्रेरणा संघ में मिलती है: डॉ मोहन जी भागवत @Devadhar,117,18,133
2015-01-24T15:59:05,RSSorg,RSS,"संघ का नाम बड़ा होने केलिए नहीं, राष्ट्र केलिए हमारा काम है : डॉ मोहनजी भागवत  @Devadhar",137,17,165
2015-01-24T16:07:01,RSSorg,RSS,"भारत विश्व गुरु बने, उसके लिए संपूर्ण समाज खड़ा होना पड़ेगा| इसीसे भारत और विस्वा का कल्याण होगा : Dr Bhagavat @Devaghar",109,22,141
2015-01-26T02:44:48,RSSorg,RSS,"Let us pledge to make our sacred motherland ""Viswa Guru"" on this auspicious Ganatantra Din. #RepublicDay",117,9,129
2015-01-29T12:57:12,RSSorg,RSS,"Nation today remembers the well known social reformer Prof. Rajendra Singh ji, the 4th SarSanghachalak of RSS on his birth anniversary.",50,4,59
2015-01-29T12:58:40,RSSorg,RSS,Rajju Bhaiyya was a firm believer in the concept of Swadeshi and strengthening of rural economy.pic.twitter.com/7ikGntg6D2,63,11,81
2015-02-01T02:18:52,RSSorg,RSS,The RSS has already made it unequivocally clear that it has no role whatsoever in the issue that led Sri Perumal Murugan to withdraw (1/N),139,3,79
2015-02-01T02:19:25,RSSorg,RSS,his book from the market. However some persons like Smt Subhashini Ali continue to drag the name of the RSS into the issue with an (2/N),132,1,67
2015-02-01T02:20:29,RSSorg,RSS,"ulterior motive to tarnish its name, which is quite deplorable. We earnestly hope that better wisdom will prevail & they would desist (3/N)",120,3,61
2015-02-01T02:22:14,RSSorg,RSS,"from such nefarious activities immediately, failing the RSS would be constrained to consider other course of action: Dr M Vaidya (n/n)",123,4,67
2015-02-01T14:10:23,RSSorg,RSS,Representatives of Yezidi community met Dr Mohanji Bhagvat today @Mysore ICCS meet.pic.twitter.com/MV8Kj2Yq4k,386,42,325
2015-02-04T05:49:29,RSSorg,RSS,Taking a portion of an article & to quote it out of context to creat confusion & mislead the public as RSS view is deplorable: Dr MVaidya,85,6,90
2015-02-08T08:24:58,RSSorg,RSS,"समाज की समस्याएं बौखलाने से नहीं, धैर्यपूर्वक खड़ा रहने से समाप्त होगी- डा:मोहन भगवत @Gaziyabad Vibhag Ekatrikaran today",149,21,185
2015-02-08T13:43:45,RSSorg,RSS,"भारत के बिना हिंदु का अस्तित्व नहीं और हिंदु के बिना भारत का अस्तित्व नहीं
-Bhaiyaji @Bengaluru #HinduSamajotsava",241,27,237
2015-02-08T13:52:13,RSSorg,RSS,"अपने समाज की कुरीतियों को समाप्त कर ही हिंदु समाज शक्तिशाली बन सकता है
-Bhaiyyaji @Bengaluru #HinduSamajotsava",122,16,156
2015-02-08T17:14:08,RSSorg,RSS,‘No Hindu without Bharat and No Bharat without Hindus': Bhaiyyaji Joshi at Hindu Samajotsav Bengaluru,192,39,188
2015-02-10T08:55:57,RSSorg,RSS,Congrats Team AAP. The thumping majority AAP received will help them to fulfill their promises &people's expectation: Dr M Vaidya,166,66,143
2015-02-15T05:32:11,RSSorg,RSS,"नदियों के दर्शन से हमारी संस्कृति और परंपरा के दर्शन होते हैं
Bhaiyaji@5th NadiMahotsav MP",63,3,84
2015-02-15T07:29:31,RSSorg,RSS,"In the whole world we alone are named after a river, we are Hindus because of Sindhu
Bhaiyaji @NadiMaholsav Madhyapradesh",88,13,119
2015-02-15T07:56:52,RSSorg,RSS,@prayasbadhala You could confirm it from the style and content of the tweets. We are on the process to acquire the official recognition.,7,0,22
2015-02-15T10:21:25,RSSorg,RSS,"परस्परावलंबन से ही प्रकृति में संतुलन स्थापित रह सकता है
Equilibrium in the nature is maintained through interdependence
-Bhaiyaji",61,8,94
2015-02-15T14:52:22,RSSorg,RSS,"संघ कार्यक्रम आत्मदर्शन है, शक्तिप्रदर्शन नहीं |
-मा: मोहनजी भागवत @Kanpur Shakti sangamam",96,9,116
2015-02-15T15:02:17,RSSorg,RSS,"Sangh program is for Self realisation, not a Rally of might.
-Dr Bhagavat @Kanpur RSS program today.",116,14,116
2015-02-18T06:05:57,RSSorg,RSS,भारत की विज्ञान दृष्टि सम्पूर्ण विश्व में फ़ैलाने की आवश्यकता है |pic.twitter.com/WKZrubsp9f,72,6,103
2015-02-18T06:09:04,RSSorg,RSS,"विज्ञान सहित सभी विषयों में भारत न केवल अग्रणी था बल्कि पुरे विश्व में यह यहीं से गया था: भैय्या जी @ विज्ञान भारती कार्यालय उद्घाटन, दिल्ली",66,3,75
2015-02-18T07:22:32,RSSorg,RSS,"विज्ञान का प्रयोग रचनात्मक कार्यों के लिए करना,यह भारत की विज्ञान दृष्टि सम्पूर्ण विश्व में फ़ैलाने की आवश्यकता है |
सरकार्यवाह भैयाजी",82,4,87
2015-02-20T13:03:27,RSSorg,RSS,"दुनिया के देशों की आंच भारत पर भी आती है | हम अपने जीवन से दुनिया को सूर्य के समान प्रकाश देंगे | 
Dr Bhagwat @Bharatpur Jaipur",80,8,86
2015-02-22T11:39:02,RSSorg,RSS,"एक ही कृति का अलग अलग व्यक्ति अलग अलग वर्णन करते है- कृति यंत्रवत करने से लक्ष्य ओझल से जाता है, उसका ध्यान रहे |
Dr Bhagwat @Bharatpur",39,1,66
2015-02-22T11:45:08,RSSorg,RSS,"अपना कार्य देश को बड़ा बनाने का कार्य है | कुछ पाने केलिए नहीं, सब कुछ देने केलिए यह कार्य है- Sarsanghchalakjipic.twitter.com/xtTsp6ndhl",111,9,123
2015-02-22T11:56:33,RSSorg,RSS,"जन, जमीन, जल, जंगल, जानवर सब मिलकर, विविधतापूर्ण स्वरुप अपना देश है | 
Dr Bhagwat @bharatpur Sanghikpic.twitter.com/OXlG8nxXiP",82,4,110
2015-02-22T12:00:20,RSSorg,RSS,"विदेशों में 'समानता से ही एकता' का दृष्टिकोण,
'अनेकता में एकता' की बात हमारा चिंतन है |
Dr Bhagwat @Bharatpur",75,2,82
2015-02-22T12:04:02,RSSorg,RSS,"पश्चिम में भाषा, वेश, पंथ, सामान आर्थिक हित के आधार पर राष्ट्र बने है |
भारत में संस्कृति ही राष्ट्रिय एकता का आधार |
Dr Bhagwat @Bharatpur",91,3,99
2015-02-22T12:08:43,RSSorg,RSS,"सेवा, परोपकार, एकत्व की साधना, आत्मीयभाव ही हमारी संस्कृति है |
Dr Bhagwat @Bharatpur",68,5,80
2015-02-22T12:09:12,RSSorg,RSS,"मातृभूमि, संस्कृति और पूर्वज के प्रति आस्था राष्ट्र को जोड़नेवाला तत्व है |
Dr Bhagwat @Bharatpur",80,4,93
2015-02-22T12:13:56,RSSorg,RSS,"Mother land, culture and respect towards ancestors are the qualities bind us together to become a RASHTRA 
Dr Bhagwat @Bharatpur",75,4,86
2015-02-22T12:18:11,RSSorg,RSS,"सेवाकार्यों को सफल करनेवाले व्यक्तियों का निर्माण संघ में होता है |
RSS creat Men who can do service activities successfully.
Dr Bhagwat",92,15,108
2015-02-22T12:23:48,RSSorg,RSS,"सभी अनुकूलता के बाद भी हम प्रतिकूलता में चले इज्राएल से पीछे रह गए, 
कारण गुणवान व देशहित जीने मरनेवाले समाज का आभाव |
Dr Bhagwat @Bharatpur",135,10,116
2015-02-22T12:36:47,RSSorg,RSS,देश केलिए जीने मरनेवाले गुणवान व्यक्ति का निर्माण एवं समाज संघठन का कार्य संघ कर रहा है | Dr Bhagwat @Bharatpur,77,11,102
2015-02-22T14:23:37,RSSorg,RSS,"अरुणाचल प्रदेश के बिना भारत अधूरा है और भारत के बिना अरुणाचल प्रदेश का कोई अस्तित्व नहीं
- Bhaiyaji today @Naharlagoon, AP",146,14,186
2015-02-22T14:30:13,RSSorg,RSS,हमारा मतभेद ईसा मसीह से नहीं उनके अनुयायियों से है जो कहते हैं कि हमारा मार्ग ही ठीक है जबकि हिन्दु कहते हैं आपका मार्ग भी ठीक है-Bhaiyaji,312,34,249
2015-02-23T10:23:57,RSSorg,RSS,"भारत की जय-पराजय हिंदू समाज के साथ जुड़ी है 
-भैयाजी@माजुली, असम 1/3",88,8,118
2015-02-23T10:25:08,RSSorg,RSS,"केवल पूजापाठ करने वाले हिंदू नहीं बल्कि अपने चिंतन को जीवन में उतारने वाले हिंदू बनें
 -भैयाजी@माजुली, असम 2/3",114,6,136
2015-02-23T10:26:02,RSSorg,RSS,"हिंदू का चिंतन शत्रु के नहीं शत्रुबुद्धि के विनाश का है
-भैयाजी@माजुली, असम 3/3",96,6,118
2015-02-23T16:30:18,RSSorg,RSS,Media reporting wrongly. At Bharatpur Ex DG BSF said that Mother Teresa did Seva with motive of conversion.,386,46,171
