timestamp,user,fullname,text,retweets,replies,likes
2017-09-16T22:34:11,HinduAmericans,Hindu Americans,I still got zero response when I asked last week how can I help donate money to help Hindu refugees from Myanmar who fled to Bangladesh.,14,3,15
2017-09-16T22:35:00,HinduAmericans,Hindu Americans,"If I wanted to help Muslim Rohingyas, I know at least 3 websites based in America I can visit right now & click to donate in just 5 minutes.",4,0,7
2017-09-16T22:35:56,HinduAmericans,Hindu Americans,Great to see!,0,0,1
2017-09-16T22:36:53,HinduAmericans,Hindu Americans,That Indian publication making crude sex toy references for Navratri should be shut down now. File a complaint. Who will take action!?,3,1,3
2017-09-16T22:39:01,HinduAmericans,Hindu Americans,This is the exact same garbage that the head of Twitter India made. Hindus did nothing to protest. So it happens again. We are a sad group.,3,0,3
2017-09-16T22:41:09,HinduAmericans,Hindu Americans,Very serious problem of Khalistanis acquiring political power in Canada. Defense Minister and soon a top politician with viral video.,4,1,7
2017-09-16T22:41:43,HinduAmericans,Hindu Americans,Please go after radical Islamists like you said you would. Crack down on the finance/charity network with Islamists inside the U.S.,0,1,1
2017-09-16T22:42:17,HinduAmericans,Hindu Americans,"Pres. Bush did a good job of cracking down on Muslim Brotherhood networks/charities, which Obama ended. Time to revive this and get serious.",0,3,1
2017-09-16T22:43:08,HinduAmericans,Hindu Americans,The problem is Treasury Sec. Munchin is an idiot. He doesn't care about this important issue. Get someone with counter-terror experience.,0,0,0
2017-09-16T22:43:45,HinduAmericans,Hindu Americans,Frank Gaffney is  an expert on this. He knows well the Muslim Brotherhood networks inside the U.S. Seek his advice and crack down hard.,0,0,0
2017-09-18T02:40:14,HinduAmericans,Hindu Americans,Where are the human rights groups? Does anyone care about the innocent Hindus of Pakistan? Where is the outrage?https://twitter.com/RameshJaipal/status/909383128564736001 …,14,3,12
2017-09-18T02:57:28,HinduAmericans,Hindu Americans,Hinduism is the most pro-environment religion and culture in the world.,27,1,44
2017-09-18T02:59:47,HinduAmericans,Hindu Americans,Rally for Rivers: Campaign aims to create public support for govt policy to revitalise water bodieshttp://www.firstpost.com/india/rally-for-rivers-campaign-aims-to-create-public-support-for-govt-policy-to-revitalise-water-bodies-4049029.html …,3,0,6
2017-09-18T05:12:50,HinduAmericans,Hindu Americans,Anglo Protestants are working together with their Salafi buddies to destroy Asian Buddhists in Myanmar.,12,2,17
2017-09-18T15:40:07,HinduAmericans,Hindu Americans,"China is taking over Nepal, Bhutan, Sri Lanka, using them as bases to control and dominate India.https://twitter.com/Chellaney/status/909784441626566657 …",4,1,7
2017-09-18T19:43:15,HinduAmericans,Hindu Americans,"There is no such thing as a ""Hindu nationalist."" 

This phrase was invented by Anglos to denigrate Hindus, India, and Hinduism.",2,3,10
2017-09-18T19:44:36,HinduAmericans,Hindu Americans,"Hindus don't want ""Hindu nation."" They just want to be treated like anyone else. No looting of Hindu temple. No $ for Rop/RoL schools/mosque",23,7,37
2017-09-18T19:47:48,HinduAmericans,Hindu Americans,"No denigrating of Hinduism, no treating Hindus as second-class citizens by blocking Hindu holidays like in West Bengal.",5,1,10
2017-09-18T19:48:21,HinduAmericans,Hindu Americans,"Just treat Hindus like anyone else. That is all. We're not asking for much. Forget about ""Hindu nation."" We don't even have equal rights!",8,0,14
2017-09-18T19:49:15,HinduAmericans,Hindu Americans,"""nationalist"" is not even a Hindu term. I don't like using it. It's a highly misleading term. It comes out of Europe.https://twitter.com/kkdr611/status/909866652723904512 …",0,1,5
2017-09-18T19:49:46,HinduAmericans,Hindu Americans,Western media and academia is anti-Hindu. Always has. Always will be. Nothing you can do about it. That's the way it is.,3,0,10
2017-09-18T20:39:55,HinduAmericans,Hindu Americans,India's English-speaking elites today are more mentally colonized now than they were even in the late 19th century at peak of British rule.,18,3,30
2017-09-18T20:40:36,HinduAmericans,Hindu Americans,"Even with BJP in power, India is still being run by Western NGOs. BJP simply reacts to whatever the Western/Congress/NGO tells them to do.",6,0,12
2017-09-19T19:46:58,HinduAmericans,Hindu Americans,"If Hindus do not get this billboard ad with Sunny Leone and Navaratri taken down, we are a worthless race of people who deserve to die out.",6,2,10
2017-09-19T19:50:45,HinduAmericans,Hindu Americans,This bastard who heads Twitter India did same sex remark on Navratri. He still leads Twitter because Hindus did nothing to protest.,2,2,5
2017-09-19T19:51:25,HinduAmericans,Hindu Americans,People feel the right to mock and denigrate Hindus. No words to describe how outrageous this billboard is. File legal cases and prosecute.,2,1,3
2017-09-19T20:34:07,HinduAmericans,Hindu Americans,Prayers for the people of Mexico City.,3,1,10
2017-09-19T23:00:57,HinduAmericans,Hindu Americans,Thoughts with the people of Mexico.,0,0,0
2017-09-19T23:01:58,HinduAmericans,Hindu Americans,"Hindus need to set up a legal center to file cases anytime Hinduism is attacked, which violates laws against religious hate and communalism.",0,0,2
2017-09-19T23:18:48,HinduAmericans,Hindu Americans,"West only respects strength. Erdogan is literaly a fascist, but West loves him,never criticizes. You don't see human-rights group attack him",14,1,17
2017-09-19T23:24:08,HinduAmericans,Hindu Americans,"Erdogan is jailing thousands of peaceful political opponents, firing tens of thousands of teachers, journalists, no one cares at all.",5,1,6
2017-09-20T00:02:21,HinduAmericans,Hindu Americans,Anglo Protestants and Arab Salafis are working together to destroy dharmic civilization.,4,1,6
2017-09-20T00:03:15,HinduAmericans,Hindu Americans,"India does nothing even near what Erdogan is doing, and yet, 24/7, human rights groups are always bashing India, while ignoring Turkey.",6,1,8
2017-09-20T05:11:48,HinduAmericans,Hindu Americans,"No one cares about KPs because they are peaceful people who love India. For Indian govt. to care, you have to hate India and be violent.",0,0,2
2017-09-20T05:13:59,HinduAmericans,Hindu Americans,But India doesn't even have equal rights for Hindus! Why not at least try to get that first. Rest will take care of itself.https://twitter.com/varanasisarma/status/910338479602700289 …,1,2,6
2017-09-20T12:45:08,HinduAmericans,Hindu Americans,You are a total moron whose party has destroyed India. Shut your stupid mouth and go back to corrupt Mafia Italy.,0,1,2
2017-09-20T12:50:10,HinduAmericans,Hindu Americans,Why does Indian media keep on highlighting every dumb thing @OfficeOfRG says while in US? Because they are both slaves to Western NGOs.,2,1,7
2017-09-20T12:50:44,HinduAmericans,Hindu Americans,India's English-language media keeps on hyping up @OfficeOfRG because he is the spokesman for Western NGOs.,1,0,6
2017-09-20T12:51:30,HinduAmericans,Hindu Americans,These Western NGOs have done more damage to India than even radical Islamists. Throw them out.,8,3,11
2017-09-20T12:55:50,HinduAmericans,Hindu Americans,India remains a backwards country of filth and poverty & corruption because of @INCIndia and Western NGOs. They are criminal organizations!,3,0,8
2017-09-20T13:11:23,HinduAmericans,Hindu Americans,Sad to hear. Prayers for the Mexican people.https://twitter.com/PostWorldNews/status/910491005677424640 …,3,0,3
2017-09-20T13:41:03,HinduAmericans,Hindu Americans,"Ok, but India is not even at the stage of Hindus being treated equally. India right now is a Muslim/Christian nation. Hindus are 2nd-class.https://twitter.com/suresh97/status/910184408526635008 …",3,1,4
2017-09-20T13:41:47,HinduAmericans,Hindu Americans,"I don't support ""Hindu nation"" because I know that if Hindus are just treated equally (which is not happening now), Hindus will thrive.",1,0,6
2017-09-20T13:59:39,HinduAmericans,Hindu Americans,India is a Muslim and Christian nation. It has special favors given to these 2 groups. Hindus are treated as 2nd-class people.,9,2,11
2017-09-20T14:07:34,HinduAmericans,Hindu Americans,"This #RGinUS is one of the biggest jokes. What a dumb moron he is, as well as a thief whose party destroyed and ruined India.",3,0,6
2017-09-20T14:08:44,HinduAmericans,Hindu Americans,"Lol, what a joke with your ""grand entry."" No one gives a damn at Princeton or India about your ""grand entry."" Are you some maharaja?",0,0,0
2017-09-20T14:09:37,HinduAmericans,Hindu Americans,What a joke is this #RGinUS. You keep on promoting this idiot and you will keep on losing. You are a joke.,0,1,9
2017-09-20T14:10:34,HinduAmericans,Hindu Americans,Interesting to see there are no protests from anti-India groups over #RGinUS. Why don't they protest massacre of Sikhs in 1984 by @INCIndia?,3,0,3
2017-09-20T15:06:36,HinduAmericans,Hindu Americans,This is 100% Hinduism. Why doesn't CNN say it? This breathing technique comes directly from Hindu scriptures.,10,1,10
2017-09-20T15:08:15,HinduAmericans,Hindu Americans,"The West steals Hindu ideas, while simultaneously attacking Hindu people.",14,3,16
2017-09-20T15:18:21,HinduAmericans,Hindu Americans,"Warning: This anti-Hindu, anti-Indian South Asian group in USA is getting bigger, hiring people, with more money. 
https://twitter.com/SAALTweets/status/910520091107880962 …",5,0,4
2017-09-20T16:59:10,HinduAmericans,Hindu Americans,"China doesn't even allow Vatican to decide Catholic leaders inside China. China decides. 

Does Indian have courage to do the same?",41,3,53
2017-09-20T19:50:42,HinduAmericans,Hindu Americans,Human rights of minorities in America are under attack. Where are the human rights groups?,3,0,6
2017-09-20T23:11:19,HinduAmericans,Hindu Americans,"Instead of focusing on serious problems like Islamic terrorism, you're attacking minorities and stripping away health care. You are a moron.",0,0,0
2017-09-20T23:12:29,HinduAmericans,Hindu Americans,My dream is for @myogiadityanath to be the next PM after Modi leaves 20 years from now.,7,4,18
2017-09-20T23:13:04,HinduAmericans,Hindu Americans,Wishing the Jewish community a happy #RoshHashanah,2,0,6
2017-09-21T00:07:24,HinduAmericans,Hindu Americans,"Hillary Clinton did Hindu technique on national TV @CNN. Hindus got zero mention, zero credit. We are stolen from while getting attacked.",6,0,8
2017-09-21T02:17:00,HinduAmericans,Hindu Americans,"Wow, your anti-Hindu hatred and lies never stops, even for a Hindu holy time. You don't have the guts to write similar tweet for Eid.",0,0,0
2017-09-21T02:17:35,HinduAmericans,Hindu Americans,"You are totally wrong to say India has high rate of attacks on women. Rate is much higher in America. Look at the stats, you lying bigot.",0,0,0
2017-09-21T02:36:57,HinduAmericans,Hindu Americans,"What a stupid, offensive thing to say. Trump is an idiot.https://twitter.com/NBCNews/status/910580150135349250 …",0,0,2
2017-09-21T02:37:51,HinduAmericans,Hindu Americans,Thank you for this helpful chart for Navratri.https://twitter.com/Vishvajit_HJS/status/910512472305496064 …,3,2,5
2017-09-21T02:39:37,HinduAmericans,Hindu Americans,"Please speak out against the unjust firing of Devan Maharaj, an Indian Hindu man, as editor of LA Times. Whites were jealous of his skills.",0,0,0
2017-09-21T02:49:53,HinduAmericans,Hindu Americans,"Hindus are under attack in both the East & West. It will be tough to survive over next 100 yrs. But let's try, & keep celebrating Hinduism.",7,0,9
2017-09-21T02:50:31,HinduAmericans,Hindu Americans,I miss Hindu IDF. What happened? Can we try to get him back. It's outrageous he was removed.,1,0,3
2017-09-21T02:57:52,HinduAmericans,Hindu Americans,Thanks to PM Modi for being the first leader of India to make cleanliness a major priority.https://twitter.com/narendramodi/status/910690197330784256 …,3,0,8
2017-09-21T02:58:45,HinduAmericans,Hindu Americans,Thank for your remembering Navratri. May Ma Durga continue to shine her divine blessings on you.,5,0,13
2017-09-21T03:14:40,HinduAmericans,Hindu Americans,This Audrey bitch is now tweeting about what she will teach on Hinduism. I urge everyone to tell all to avoid her classes. Boycott her!,5,3,12
2017-09-21T05:29:31,HinduAmericans,Hindu Americans,"You are a Mafia moron who hates Indians and Hindus, so please spare us your dumb hypocrisy on Navratri.",0,0,8
2017-09-21T06:25:36,HinduAmericans,Hindu Americans,"Throw out Washington Post, New York Times, and BBC from India. Give them 15 days to leave India.",12,2,19
2017-09-21T06:26:16,HinduAmericans,Hindu Americans,"Also, time to enforce the laws regulating Western NGOs. Anyone caught violating needs to leave Indian and stop all financing in India.",5,2,12
2017-09-21T06:29:05,HinduAmericans,Hindu Americans,"Trump attacks Latinos and Asians, while he does nothing to go after radical Islam like he said he would. What an idiot.",1,1,1
2017-09-21T06:37:06,HinduAmericans,Hindu Americans,Shut your stupid mouth. You and @INCIndia and your Mafia mom looted India and destroyed its economy for the past 70 years.,0,1,0
2017-09-21T06:37:41,HinduAmericans,Hindu Americans,"yes, good idea",0,0,0
2017-09-21T06:40:04,HinduAmericans,Hindu Americans,Every NRI hates you and your corrupt @INCIndia. You are total jokes who destroyed India and forced Indians to leave India for better life.,8,0,33
2017-09-21T14:25:09,HinduAmericans,Hindu Americans,BJP/RSS has failed to create a professional intellectual eco-system.,4,1,10
2017-09-21T16:07:43,HinduAmericans,Hindu Americans,You are a liar. Communal attacks were much higher under @INCIndia rule. And your trip was a failure. No Indian-Americans even cared about it,3,0,8
2017-09-21T16:08:17,HinduAmericans,Hindu Americans,"You hate the fact that Indians both inside India and in America love and support Modi. You are a spoiled, corrupt, dumb Mafia brat.",1,0,2
2017-09-21T16:09:18,HinduAmericans,Hindu Americans,"Hindus tell the truth. Anti-Hindu forces are serial liars. They can only win by lying and lying, about the world, nature, reality.",17,1,23
2017-09-21T16:44:57,HinduAmericans,Hindu Americans,"I warned you last year about @tufailelif, that he was a Sufi fraud. I was right, and he blocked me on Twitter for exposing his lies.",45,10,73
2017-09-21T16:46:23,HinduAmericans,Hindu Americans,"Now, this Tufail fraud is attacking Hindu ""idol worship."" Who the hell is this Sufi idiot to lecture Hindus about what we do?! Get lost.",9,2,19
2017-09-21T17:02:01,HinduAmericans,Hindu Americans,Only a people as slavish and dumb as English-speaking Indians would make a second-rate pornographer like Sunny Leone as big star in India.,7,5,11
2017-09-21T17:02:37,HinduAmericans,Hindu Americans,India's Anglicized elites are some of the worst people in this world. They are embarrassing.,3,0,7
2017-09-21T17:23:09,HinduAmericans,Hindu Americans,"In case you forgot, Sufis also killed millions of Hindus, attacking our so-called ""idol"" worship, demolishing Hindu temples for mosques.",8,0,16
2017-09-21T18:51:29,HinduAmericans,Hindu Americans,"Shame on Twitter for now featuring on its home page a story about the Sunny Leone, mocking Indians, making generalizations. Racist crap.",3,1,13
2017-09-21T18:52:05,HinduAmericans,Hindu Americans,"On Twitter's home page now, they are featuring this Sunny Leone, mocking Indians. Will they do same for Eid or Christmas?",5,3,11
2017-09-21T19:30:12,HinduAmericans,Hindu Americans,The UK is now 100% against Myanmar's Buddhist community. What racist colonial idiots they are. They've always hated Asians.,2,0,4
2017-09-21T20:20:56,HinduAmericans,Hindu Americans,Hooray for court in Calcutta. Great to finally see India's judiciary respect the rights of Hindus.https://twitter.com/republic/status/910810376056446976 …,2,0,5
2017-09-21T20:22:17,HinduAmericans,Hindu Americans,Why didn't you get a book deal on your presidential campaign coverage? Because you're a minority and the USA publishing industry is racist.,0,0,0
2017-09-22T03:15:29,HinduAmericans,Hindu Americans,Bravo! It's about time. So glad to see India finally calling Pakistan what it truly is -- a criminal nation of terror.https://twitter.com/sambitswaraj/status/911064226743152640 …,7,1,13
2017-09-22T03:16:16,HinduAmericans,Hindu Americans,Thank you! Your warm Navratri greetings are greatly appreciated. Many Hindus share your commitment to justice and humanity.,0,0,1
2017-09-22T05:45:25,HinduAmericans,Hindu Americans,India's English-language media is total colonial garbage. Time to start building regional Indian-language media with dharmic views.,4,1,12
2017-09-22T05:45:59,HinduAmericans,Hindu Americans,"Anti-Hindu forces are working all the time to destroy Hinduism, not just through violence, but psychological warfare. They are sick.",9,2,21
2017-09-22T05:46:29,HinduAmericans,Hindu Americans,"Get lost, you dumb Mafia moron.",0,2,2
2017-09-22T12:52:46,HinduAmericans,Hindu Americans,Because India is a joke. It still doesn't take seriously the threats it's facing.https://twitter.com/Chellaney/status/911190336000606208 …,2,0,3
2017-09-22T12:53:14,HinduAmericans,Hindu Americans,The British are the most active supporters of Islamic terrorism in the world.,7,1,7
2017-09-22T12:53:47,HinduAmericans,Hindu Americans,The British destroyed India. They are not friends of India. Their only goal is to keep India weak and subservient.,11,3,16
2017-09-22T17:46:36,HinduAmericans,Hindu Americans,"Come on, this is really unfair. BJP is not a supremacist organization. They are peaceful. They still give govt. money for Muslims/Christians",0,1,1
2017-09-22T17:47:14,HinduAmericans,Hindu Americans,"Under BJP rule, India still gives special govt. money for hajj trips, madrasas, schools. Hindus are still second-class citizens in India.",0,1,1
2017-09-22T17:48:26,HinduAmericans,Hindu Americans,I warned everyone last year about this Tufail Sufi fraud guy. He is total joke who's actually anti-Hindu. He blocked me after I exposed him.,7,3,15
2017-09-22T17:51:46,HinduAmericans,Hindu Americans,"Now, some of you naive Hindus keep on supporting this Imam Tawhidi, another fraud who's playing you for fools. Another Sufi taquiya Muslim.",4,2,10
2017-09-22T18:24:34,HinduAmericans,Hindu Americans,"I wouldn't say most Hindus in general, but most English-speaking Hindus are a silly bunch. They have colonized brains.https://twitter.com/Max_Haveloos/status/911287617345523713 …",2,1,7
2017-09-22T18:25:03,HinduAmericans,Hindu Americans,Very nice!https://twitter.com/PIB_India/status/911241705390669829 …,1,0,4
2017-09-22T18:25:37,HinduAmericans,Hindu Americans,"This Mamta is like another Erdogan, but where are so-called human rights groups? Why aren't they criticizing her?",7,1,12
2017-09-22T19:09:03,HinduAmericans,Hindu Americans,"tweet more about unique cultures. american tv is garbage anyways, and racist. it's about promoting white supremacy.",0,0,0
2017-09-22T19:10:30,HinduAmericans,Hindu Americans,Imagine outrage if a BJP leader acted like Mamta does. No words to describe the hypocrisy of the West and so-called human-rights groups.,8,2,12
2017-09-22T19:28:36,HinduAmericans,Hindu Americans,"The British are now obsessively attacking Buddhists in Myanmar. No surprise. These British are #1 supporters of Taliban, Al-Qaeda, Saudis.",23,6,34
2017-09-22T19:33:34,HinduAmericans,Hindu Americans,The British are the #1 source of problems in the world over the past 100 years.,7,1,13
2017-09-22T20:26:03,HinduAmericans,Hindu Americans,"Why are you hyping this up? Muslims and Christians do much worse things, like killing people. I never see you report on that.",0,1,0
2017-09-22T20:26:57,HinduAmericans,Hindu Americans,Thank you for your kind Navratri greetings! Much appreciated.,0,0,1
2017-09-22T20:27:42,HinduAmericans,Hindu Americans,"I sometimes get confused by what is proper fasting during Navratri. I keep hearing different messages, requirements. What is good rule?",1,2,3
2017-09-22T20:28:35,HinduAmericans,Hindu Americans,"Some say no grains, others say only no solids. For example, peopel say PM Modi only takes warm water, but he must be doing some eating too.",0,1,3
2017-09-22T20:56:49,HinduAmericans,Hindu Americans,"No Hindu is ""rightwing."" The most ""rightwing"" Hindu is actually a liberal compared to even moderate Muslims and Christians.",12,1,24
2017-09-23T18:55:09,HinduAmericans,Hindu Americans,"Thank you, Mayor! Much appreciated. Very kind of you to wish a happy Navratri, the 9-day festival of the divine goddess.",1,0,4
2017-09-23T18:57:11,HinduAmericans,Hindu Americans,"Dear @PTI_News, Stop using ""godman"" in your articles. This is an inaccurate term, & offensive. Do you use it for Muslims/Christian leaders?",4,1,7
2017-09-23T18:59:04,HinduAmericans,Hindu Americans,"There is a clear pattern of India's English-language media using terms that are inaccurate & denigrating of Hindus, like ""godman."" @PTI_News",2,0,3
2017-09-23T18:59:40,HinduAmericans,Hindu Americans,Please retweet this tweet below from New York Mayor:https://twitter.com/NYCMayor/status/911336119018586112 …,4,0,4
2017-09-23T19:01:07,HinduAmericans,Hindu Americans,Another case of a Hindu leader charged with assault. Any truth to these claims? Or a pattern of targeting Hindu leaders? I think the latter.,1,0,2
2017-09-23T19:04:24,HinduAmericans,Hindu Americans,India's English-language media is anti-Hindu. It was designed that way. They were created under British rule to weaken India.,5,0,14
2017-09-23T19:08:17,HinduAmericans,Hindu Americans,V.S. Naipaul wrote 20 years ago that Pakistan was basically a criminal operation.,3,0,8
2017-09-23T19:10:13,HinduAmericans,Hindu Americans,"While I appreciate Sushma's talk, India should not get too complacent. Honestly, India's universities are not good compared to China, Korea.",11,11,16
2017-09-23T19:11:16,HinduAmericans,Hindu Americans,India is nowhere near China and tiny Korea in terms of universities and technology. India should not get too proud. We have long way to go.,7,1,11
2017-09-23T19:17:33,HinduAmericans,Hindu Americans,"India also remains a dirty country with no sense of public cleanliness, no good clean water supply, and poor roads, infrastructure.",3,4,8
2017-09-23T19:22:19,HinduAmericans,Hindu Americans,"Pakistani-American fanatic extremist cleric in Texas, USA, who hates non-Muslims has been accused of harassing womenhttps://en.dailypakistan.com.pk/world/religious-speaker-nouman-ali-khan-accused-of-inappropriate-interactions-with-female-followers/ …",6,0,3
2017-09-23T19:24:31,HinduAmericans,Hindu Americans,"Hindus are under attack everywhere, both West and East.",3,2,7
2017-09-23T19:36:43,HinduAmericans,Hindu Americans,"I realize what I'm saying may seem harsh, but Hindus have to realistic about our conditions. We are honest people that tells the truth.",1,2,5
2017-09-23T19:39:37,HinduAmericans,Hindu Americans,"Trump is ignoring the problem of radical Islam, while needlessly going after North Korea, Cambodia, Myanmar. The West always hates Asians.",3,0,8
2017-09-23T19:58:08,HinduAmericans,Hindu Americans,"Sorry, the truth has to be said. China is way ahead of India. Not even close. If you're serious about moving ahead, you need to be honest.https://twitter.com/UGC0071/status/911677547674402817 …",0,1,0
2017-09-23T19:58:53,HinduAmericans,Hindu Americans,"If China and Pakistan united to invade India, India would probably lose. That's a fact. India lacks defense, tech, economy, to defend.",2,1,3
2017-09-23T20:00:46,HinduAmericans,Hindu Americans,Islamic extremism is not the problem. Islam is the problem.,2,1,10
2017-09-23T20:00:59,HinduAmericans,Hindu Americans,"Wow, very nice!https://twitter.com/DrShobha/status/911608533669494784 …",0,0,4
2017-09-23T20:36:13,HinduAmericans,Hindu Americans,The West is allying with Sunni Arab extremists to destroy India and other Asian countries.,7,1,13
2017-09-23T23:10:43,HinduAmericans,Hindu Americans,Why is America so obsessed with attacking North Korea? Why don't they attack Pakistan instead and destroy its military?,7,6,18
2017-09-25T13:44:55,HinduAmericans,Hindu Americans,"The West loves Pakistan's military and Sunni Islamism. Always has. Always will. 

This will never change. India just has to deal with it.",2,1,4
2017-09-25T13:45:32,HinduAmericans,Hindu Americans,You're nothing but a corrupt Mafia stooge whose party has destroyed India. Get lost and go move to Italy.,0,0,0
2017-09-25T13:47:36,HinduAmericans,Hindu Americans,"This is unbelievably outrageous. There is a clear pattern to make Jammu the next Srinagar, to ethnically cleanse all non-Muslims. Dangerous.https://twitter.com/Prof_HariOm/status/912311284485337088 …",22,1,15
2017-09-25T14:14:13,HinduAmericans,Hindu Americans,"Pres. Obama deported 2.5 million illegal immigrants. 2.5 million! Trump wants to deport even more.

Where are the human rights groups?",12,4,17
2017-09-25T14:20:17,HinduAmericans,Hindu Americans,"In contrast, PM Modi has not even deported even 1 illegal immigrant, despite major security problem in Bengal, Jammuhttps://twitter.com/HinduAmericans/status/912319330355904514 …",6,1,4
2017-09-25T14:26:42,HinduAmericans,Hindu Americans,"Kashmiri Hindus still can't return to Kashmir valley for past 25 yrs, but India is settling Rohingya Muslims in Jammu & Kashmir. Outrageous.",7,0,6
2017-09-25T15:40:47,HinduAmericans,Hindu Americans,China has done a great job at creating pro-China media in both Chinese and English languages. Look to see how good quality it is.,9,1,11
